author_flair_richtext,score,body,subreddit,log_proba,log_adjust
"[{'a': ':demonhunter:', 'e': 'emoji', 'u': 'https://emoji.redditmedia.com/rgmxx30ubas21_t5_2qio8/demonhunter'}]",1,"&gt; bring in grouped flight combat with mount abilities (like oculus, but not as simplistic), or even hooked mount jumping (like the hyldsmeet)

please no...",wow,0.5090743734235944,angry
[],1,is this a complaint about alliance wanting high elves and getting void colored ones?,wow,0.6539182114190009,angry
[],1,"i play tons of games other than wow. dota2, starcraft remastered, starcraft ii, as well as more steam games than i'll have time to play in my entire life.  


i want to play tons of games other than wow, and a mac is perfect for that.",wow,0.5975173882470162,angry
"[{'a': ':alliance:', 'e': 'emoji', 'u': 'https://emoji.redditmedia.com/goroi8cl9as21_t5_2qio8/alliance'}, {'a': ':druid:', 'e': 'emoji', 'u': 'https://emoji.redditmedia.com/zx1xwa2ubas21_t5_2qio8/druid'}]",1,"i did test it but on tank-dummy where i just did 2 meele hits to start combat on then only healed me and the dummy hit me it proced, but on a solo trining-dummy it did not proc don t know if it bis because of how the dummys are progremmd or the other one did hit me  :-/",wow,0.4241255115528156,angry
[],1,as far as i know its 75/50/25 for infinite stars,wow,0.6365978786525767,angry
[],1,"i don't think they intended people to farm for it. just like rivendare's horse in vanilla, it's one of those things that adds to the game that it's so rare it doesn't make sense to try to get it. if it happens it happens, but just like buying a powerball ticket, you don't play to win. you play to dream of winning. you can quickly waste your life if you play to win these things.",wow,0.2795034792688772,angry
[],1,that looks like activison taking over blizzard.,wow,0.7330084212829034,happy
"[{'a': ':alliance:', 'e': 'emoji', 'u': 'https://emoji.redditmedia.com/goroi8cl9as21_t5_2qio8/alliance'}, {'a': ':deathknight:', 'e': 'emoji', 'u': 'https://emoji.redditmedia.com/kbwt6n89aas21_t5_2qio8/deathknight'}]",1,"it's been like this since mop.

curse you mop qa team!!!!",wow,0.6451949678242904,angry
"[{'a': ':horde:', 'e': 'emoji', 'u': 'https://emoji.redditmedia.com/o47j6d3ubas21_t5_2qio8/horde'}, {'a': ':druid:', 'e': 'emoji', 'u': 'https://emoji.redditmedia.com/zx1xwa2ubas21_t5_2qio8/druid'}]",1,"no it's not, because you're ignoring all the overhead of forming a group and keeping a group focused.  that adds up if you have a bunch of small tasks you want to get done and they're not all related.  

as a tank can swoop into an area,  quickly pull and gather all the mobs and everyone else runs over and kills them instantly.   it's pretty damn fast already.",wow,0.5751154503442789,angry
[],1,okay thank you so much.,wow,0.9042124125445228,happy
"[{'a': ':horde:', 'e': 'emoji', 'u': 'https://emoji.redditmedia.com/o47j6d3ubas21_t5_2qio8/horde'}, {'a': ':warlock:', 'e': 'emoji', 'u': 'https://emoji.redditmedia.com/9t4aj3ytbas21_t5_2qio8/warlock'}]",1,""" like if somebody will double down this hard after being proven wrong  about something this inconsequential, what must it be like trying to  convince them they're wrong about something that matters? ""

i wanted to say something funny to this involving politics, but then every joke i could think of ended up depressing me.",wow,0.4218861514456069,angry
[],1,"kept my macs to play wow, dota2, heroes of the storm, starcraft remastered, starcraft ii, and more steam games than i will have time to play in my entire life. never looked back.  


and i love my macs.",wow,0.6260517820492763,angry
"[{'a': ':hunter:', 'e': 'emoji', 'u': 'https://emoji.redditmedia.com/5e23dd8ubas21_t5_2qio8/hunter'}]",1,"yeah, and that's one of several reasons that mop pvp was considered very good. you could easily gear up any character and participate in pvp without grinding azerite or ap or shadowmourne or vial of shadows or cunning of the cruel or fangs of the father or dragonwrath or...

a lot of players miss just being able to crank out some bgs and then hop in to arena, myself included. most of my friends from cata-mop era quit shortly into legion because the pve grinding turned them off.",wow,0.638764287776714,angry
[],1,"good design: naturally play longer without any extrinsic motivation because the game is fun in and of itself

bad design: perhaps fun initially but extended artificially by providing extrinsic rewards (random gear, titanforging, corruption). players only play to achieve said rewards",wow,0.6068724990753391,angry
"[{'a': ':alliance:', 'e': 'emoji', 'u': 'https://emoji.redditmedia.com/goroi8cl9as21_t5_2qio8/alliance'}]",1,"&gt;we’re they implementing a choice mechanic for the chest or was that just an idea for shadowlands?

that's just planned for shadowlands",wow,0.4274640119772662,angry
"[{'a': ':druid:', 'e': 'emoji', 'u': 'https://emoji.redditmedia.com/zx1xwa2ubas21_t5_2qio8/druid'}]",1,"cns is 5 weeks (or, more specifically, 5 resets, so fewer than 5 calendar weeks unless you start on a tuesday...) with essentially zero effort to 1400. it is only 3 resets with slightly more effort if you grind a bit later to 1600.

breath of the dying is 4-5 weeks no matter what you do and involves doing dailies every day for a whole month. players are only a little over halfway past honored right now in 2 weeks with all the static quests out of the way. not going to be much faster unless you go crazy with contracts on every wq every day.

really not sure how the two are comparable effort-wise. cns might be one of the single lowest effort to get rank 3 essence in the entire game.",wow,0.5131048819318546,angry
[],1,"i'm a mac user. no denial. it's completely possible.  


my steam account is filled with more games than i'll ever have time to play. still play mostly just blizzard games and dota2 tho.",wow,0.4522782628808074,angry
[],1,what a weird way to spell awesome,wow,0.881160005994832,happy
"[{'e': 'text', 't': ""Hail N'zoth""}]",1,it says failed in your log.,wow,0.6377894844940134,angry
[],1,i realise this. but why include a very niche part of the game in the quest line in the first place? it’s not like 8.3 is overflowing with good content,wow,0.6271141837890272,angry
[],1,it was a joke,wow,0.6776174944057753,angry
"[{'a': ':alliance:', 'e': 'emoji', 'u': 'https://emoji.redditmedia.com/goroi8cl9as21_t5_2qio8/alliance'}]",1,"honestly, i have no idea what blizzard was thinking with this whole expansion, let alone these corruption effects. does no one check anyone else's work or ideas any more over there??

like, on some level i can understand echoes doing x% of total hp in damage -- it could be a fun or interesting mechanic *if* our total hp didn't grow by like 900% from the end of legion to now. but the stat inflation this expansion is literally insane; like warlords + legion all over again, except just in *one* expansion. are they just going to start doing ilevel and stat (and level?) resets with *every* expansion now??

i didn't mean to get off on a tangent, but i feel like maybe all of this is inter-connected...? idk.. :/",wow,0.3431879605008711,angry
"[{'a': ':demonhunter:', 'e': 'emoji', 'u': 'https://emoji.redditmedia.com/rgmxx30ubas21_t5_2qio8/demonhunter'}]",1,god this brings me back.. i miss nyhm :c,wow,0.6563271618067384,angry
"[{'a': ':horde:', 'e': 'emoji', 'u': 'https://emoji.redditmedia.com/o47j6d3ubas21_t5_2qio8/horde'}, {'a': ':warlock:', 'e': 'emoji', 'u': 'https://emoji.redditmedia.com/9t4aj3ytbas21_t5_2qio8/warlock'}]",1,""" this is entirely false. in vanilla wow, npcs used to actively insult warlock pcs if you talked to them. "" i never said the opposite? in vanilla wow, the player warlocks and small amount of adventurer warlocks, werent heroes that saved the fucking world multiple times. in fact i'm pretty sure i stated that the adventurer warlocks were the exception.

&amp;#x200b;

oh wait i did.

"" lol, what are you talking about? unlike you, i'm not arguing about my personal morality. ""

&amp;#x200b;

sure sounds like you are. meanwhile ive just been stating basically ""in this scene, darion mograine blatantly shows empathy and uneasiness to committing a crime against the paladins"". you just keep saying its sociopathy.

"" are you actually arguing that all the thousands of people punisher killed was worth one life saved? ""

"" also frank saves a hell of a lot more than one person. """,wow,0.3472212083915508,angry
"[{'a': ':druid:', 'e': 'emoji', 'u': 'https://emoji.redditmedia.com/zx1xwa2ubas21_t5_2qio8/druid'}]",1,so dont do pet battles.....you arent owed every single mount in the game you know....,wow,0.352727956704883,angry
"[{'a': ':alliance:', 'e': 'emoji', 'u': 'https://emoji.redditmedia.com/goroi8cl9as21_t5_2qio8/alliance'}, {'a': ':hunter:', 'e': 'emoji', 'u': 'https://emoji.redditmedia.com/5e23dd8ubas21_t5_2qio8/hunter'}]",1,lol i did this too,wow,0.7472373763242861,happy
"[{'a': ':alliance:', 'e': 'emoji', 'u': 'https://emoji.redditmedia.com/goroi8cl9as21_t5_2qio8/alliance'}, {'a': ':deathknight:', 'e': 'emoji', 'u': 'https://emoji.redditmedia.com/kbwt6n89aas21_t5_2qio8/deathknight'}]",1,"&gt; doesnt help that destro probably isnt the best spec for arena

why are you even making claims like this while not actually knowing anything about the subject at hand?",wow,0.5837708893757502,angry
"[{'a': ':horde:', 'e': 'emoji', 'u': 'https://emoji.redditmedia.com/o47j6d3ubas21_t5_2qio8/horde'}, {'a': ':deathknight:', 'e': 'emoji', 'u': 'https://emoji.redditmedia.com/kbwt6n89aas21_t5_2qio8/deathknight'}]",1,"yeah i think i'm done arguing with a brick wall about fictional zombie knights for tonight.

man shit like this is depressing to me. like if somebody will double down this hard after being proven wrong about something this inconsequential, what must it be like trying to convince them they're wrong about something that matters?",wow,0.4932182615550426,angry
[],1,my friend still had a priest called fiddles,wow,0.6010843546946915,angry
"[{'a': ':horde:', 'e': 'emoji', 'u': 'https://emoji.redditmedia.com/o47j6d3ubas21_t5_2qio8/horde'}, {'a': ':monk:', 'e': 'emoji', 'u': 'https://emoji.redditmedia.com/1xf0739ubas21_t5_2qio8/monk'}]",1,"oh wow. i actually reported some people for that exact same scenario in cataclysm, they left our guild and would just incessantly harass our members, and once everyone put them on ignore they'd create new characters to do it again, and they kept it up for a month straight. gms said they would do absolutely nothing because technically no rules were being broken, and the only thing we could do is just keep ignoring their alts.",wow,0.29434122144416514,angry
"[{'a': ':warlock:', 'e': 'emoji', 'u': 'https://emoji.redditmedia.com/9t4aj3ytbas21_t5_2qio8/warlock'}]",1,"https://www.wowhead.com/spell=32388/shadow-embrace

there's a checkbox for drain soul that changes how it reads. it does work. (you can also swap talents in-game, and shadowy embrace changes wording.)",wow,0.6885481253610348,angry
[],1,"yeah, i dont like it when people personally attack others for having opposing opinions, im just saying why people arent that big of a fan for nzoth's 'death' and why people refuse to trust blizzard's ability to write a somewhat decent (main) story anymore  


there are a few amazing small questlines here and there that are far better and deeper than the main storylines (imo, the cata revamp of the azshara zone questline, where you learn of what happened in the nelf ruins in the southeast, was really interesting. shame not much was mentioned about it afterwards)",wow,0.33939376801452364,angry
[],1,"&gt; every player character in the game is a sociopath by your logic. they all have the option of killing both red and green dragons.

canonically you don't have thousands of dks running through this. there's only one dk champion.

and yes, canonically the champion dk is a sociopath.

this is the word you used to describe the ebon blade:

""altruism is the principle and moral practice of concern for happiness of other human beings and/or animals, resulting in a quality of life both material and spiritual.""

yeah bro, that's totally dks. anyone who brags about being a psych minor is seriously not worth taking seriously.",wow,0.6080043257588286,angry
[],1,"right, 

\- like the buggy launch

\- banning people for the buggy quests

\- unnecessary phasing

\- the imbalanced talents

\- the transmog bugs that was introduced with the heritage armor

\-actually dont even need to write this out [https://www.youtube.com/watch?v=k2gyrvyv\_xo](https://www.youtube.com/watch?v=k2gyrvyv_xo)",wow,0.4846911557228179,angry
[],1,"just realized you are right, that storm peaks and icecrown are made for flying.  think of all those cool caves all over storm peaks you can fly down into from up high, or icecrown's crazy frostwyrm that blasts you out of the sky unless you stay up by the ships.  and those crazy bridges (gates) and the two platforms you could do bombing runs on... omg or jump-bot!  yes those were the days where flying had a purpose other than farming or stalking rares...  a zone specific purpose by design.",wow,0.5433102019941946,angry
[],1,or they could just not have put shitty pet battles in a 30 day mount quest line 😂 what’s next having your best essences for pve locked behind 40 hours of pvp.... oh wait 😂,wow,0.5554927406955872,angry
"[{'a': ':alliance:', 'e': 'emoji', 'u': 'https://emoji.redditmedia.com/goroi8cl9as21_t5_2qio8/alliance'}, {'a': ':deathknight:', 'e': 'emoji', 'u': 'https://emoji.redditmedia.com/kbwt6n89aas21_t5_2qio8/deathknight'}]",1,humans would usually get dps trinkets from raid to combine with pvp dps trinket.,wow,0.7106011216671678,happy
[],1,"it isn't hoping for death, it is hoping for past non existence.",wow,0.6001512776903405,angry
[],1,"i just resubbed and decided it was time to leave my dead realm (winterhoof) and start anew. i have about 80,000 gold on my main but idk if its worth paying for a transfer and preferably a faction change, thoughts? thanks!",wow,0.6285474054537797,angry
"[{'a': ':alliance:', 'e': 'emoji', 'u': 'https://emoji.redditmedia.com/goroi8cl9as21_t5_2qio8/alliance'}, {'a': ':deathknight:', 'e': 'emoji', 'u': 'https://emoji.redditmedia.com/kbwt6n89aas21_t5_2qio8/deathknight'}]",1,"then you do the work that is necessary to do as much damage as possible, stop crying ya big babies.",wow,0.6545042117948854,angry
"[{'a': ':druid:', 'e': 'emoji', 'u': 'https://emoji.redditmedia.com/zx1xwa2ubas21_t5_2qio8/druid'}]",1,"you can buy level 25 pets on the ah. a little pricey then their level 1 counterparts, but shouldnt be too much to get a decent team",wow,0.705713124558148,happy
"[{'a': ':alliance:', 'e': 'emoji', 'u': 'https://emoji.redditmedia.com/goroi8cl9as21_t5_2qio8/alliance'}, {'a': ':druid:', 'e': 'emoji', 'u': 'https://emoji.redditmedia.com/zx1xwa2ubas21_t5_2qio8/druid'}]",1,"i've still got two vessels left, maybe i'll give that a shot.  thank you. :d",wow,0.7348807965674928,happy
[],1,太謝謝了！ (:,wow,0.7439326991914629,happy
[],1,"for the last time, stop replying in different threads. seriously - be a big boy and summarize your points in one thread.

&gt;btw warlocks still reside solely in murder row, shady bars, and the cleft, like always. like i said, adventurer locks are the only ones really treated well.

this is entirely false. in vanilla wow, npcs used to actively insult warlock pcs if you talked to them.

&gt;and there we have it. you do not agree with ends justifys the means. thats why you have this hang up on dks, frank, and warlocks.

lol, what are you talking about? unlike you, i'm not arguing about my personal morality. 

are you actually arguing that all the thousands of people punisher killed was worth one life saved?",wow,0.42466263682759964,angry
"[{'a': ':horde:', 'e': 'emoji', 'u': 'https://emoji.redditmedia.com/o47j6d3ubas21_t5_2qio8/horde'}, {'a': ':deathknight:', 'e': 'emoji', 'u': 'https://emoji.redditmedia.com/kbwt6n89aas21_t5_2qio8/deathknight'}]",1,"every player character in the game is a sociopath by your logic. they all have the option of killing both red and green dragons.

resurrecting dead powerful beings is actually the best way to save the planet when that specifically is what you are able to contribute to a coalition saving the planet. 

i've got a minor in psych my guy, i dont need sociopathy defined. most lore death knights do have some of those tendencies, but you are willfully ignoring that the reason the ebon blade do what they do is altruistic at its core.

you're also using a lot of logical fallacies throughout your argument so i'm betting no amount of evidence is going to convince you otherwise.",wow,0.3096263098464732,angry
[],1,strength of earth and stone skin totem basically loved feeling like a true support dps off healer in dungeons,wow,0.6812676096170714,angry
"[{'a': ':horde:', 'e': 'emoji', 'u': 'https://emoji.redditmedia.com/o47j6d3ubas21_t5_2qio8/horde'}]",1,a sock puppet theater reenactment,wow,0.7439326991914629,happy
"[{'a': ':alliance:', 'e': 'emoji', 'u': 'https://emoji.redditmedia.com/goroi8cl9as21_t5_2qio8/alliance'}, {'a': ':deathknight:', 'e': 'emoji', 'u': 'https://emoji.redditmedia.com/kbwt6n89aas21_t5_2qio8/deathknight'}]",1,"&gt; i'm completely uninterested in pvp period.

why bother then? just let it go, get the second best thing and deal with it.",wow,0.5023852468842631,angry
[],1,your momma so fat it took 7 warlocks to summon her to icc. heard this before a raid in lk times.,wow,0.6682036004914786,angry
[],1,"are we just copying everything from ffxiv line for line now, or what?",wow,0.62329336925776,angry
[],1,my guild has been wishing dick cancer on the guy who thought this one up.,wow,0.4928627408341993,angry
[],1," yo momma so ugly, illidan was not prepared.",wow,0.7116936441008933,happy
[],1,"i fully agree with you, in any game, there is barely any difference at all between a bot farm and multiboxing via macros. so one person is playing 0/5 characters and the other is playing 1/5, wow, big difference.",wow,0.5888924871400751,angry
"[{'a': ':alliance:', 'e': 'emoji', 'u': 'https://emoji.redditmedia.com/goroi8cl9as21_t5_2qio8/alliance'}, {'a': ':deathknight:', 'e': 'emoji', 'u': 'https://emoji.redditmedia.com/kbwt6n89aas21_t5_2qio8/deathknight'}]",1,"you're a destrolock, whats the problem?",wow,0.6553519855495333,angry
[],1,"lol i wasn't trying to argue or anything, i was just making sure you knew you could save some cash in the future. with windows 10 you can convert those purchased oem keys to one bound to your microsoft account. as long as you do that it's not bound to hardware because you can login to your microsoft account and unbind the old pc (or pc setup) from the key for reuse.",wow,0.6120210038055206,angry
[],1,"same, anyone know whats up?",wow,0.5897164202927653,angry
[],1,"it's definitely the best seasonal affix they've introduced, if not one of the best affixes all included. the enemies are interesting and the portal allows for some customisation to your run depending on your group composition/other affixes for the week.

the best part? it's not beguiling. not once have i thought ""god damn there's an obelisk here"", which i found myself repeating constantly when beguiling/infested were in season.

but i still think it's ridiculous that they designed an affix to lessen the dominance of shroud, instead of just separating the cd between combat potions and skaggldrynks/other invis pots...",wow,0.5954432261867258,angry
"[{'a': ':alliance:', 'e': 'emoji', 'u': 'https://emoji.redditmedia.com/goroi8cl9as21_t5_2qio8/alliance'}, {'a': ':demonhunter:', 'e': 'emoji', 'u': 'https://emoji.redditmedia.com/rgmxx30ubas21_t5_2qio8/demonhunter'}]",1,"affliction is most definitely not top in any area of the game right now, be it raiding, m+, arenas or bgs. destro is better in basically all of these.",wow,0.5104253941466794,angry
"[{'a': ':horde:', 'e': 'emoji', 'u': 'https://emoji.redditmedia.com/o47j6d3ubas21_t5_2qio8/horde'}, {'a': ':paladin:', 'e': 'emoji', 'u': 'https://emoji.redditmedia.com/uvkv4eutbas21_t5_2qio8/paladin'}]",1,good luck and welcome to the world of mandarin :),wow,0.893506518546381,happy
[],1,"it is great attention to detail. if there is anything blizzard does right it is the art, sound, and attention to detail.",wow,0.6886470820595411,angry
"[{'a': ':warlock:', 'e': 'emoji', 'u': 'https://emoji.redditmedia.com/9t4aj3ytbas21_t5_2qio8/warlock'}]",1,"i hate to sounds like a herp-de-derp blizzard whiner, but i think the whole current flying situation is indicative of broader problems blizzard has with the whole 'play it how we want you to' thing.  sure, maybe flying never should have been implemented, but it has been, so instead of just time/rep gating it (i.e. putting it in the too-hard box), why not embrace it?

they could have:

1. a max level zone (e.g. suramar) which is in the clouds.
2. have wqs at max level where flying is a core part of it (like the serpent racing in pandaria). 
3. bring in grouped flight combat with mount abilities (like oculus, but not as simplistic), or even hooked mount jumping (like the hyldsmeet)
4. a 'through the infrastructure' type flight mission

also, just stop trying to hide behind ""but we want the players to experience the game on the ground"" etc. no, you want to gate things to keep people subscribed for longer. stop acting like these choices are based on quality gameplay. it's fine, you're a business, i get it, but stop acting like you've been altruistic in any way since wrath.",wow,0.16008602762323312,angry
"[{'a': ':horde:', 'e': 'emoji', 'u': 'https://emoji.redditmedia.com/o47j6d3ubas21_t5_2qio8/horde'}, {'a': ':warlock:', 'e': 'emoji', 'u': 'https://emoji.redditmedia.com/9t4aj3ytbas21_t5_2qio8/warlock'}]",1,"and there we have it. you do not agree with ends justifys the means. thats why you have this hang up on dks, frank, and warlocks.

&amp;#x200b;

also frank saves a hell of a lot more than one person.",wow,0.6267616370303214,angry
"[{'a': ':horde:', 'e': 'emoji', 'u': 'https://emoji.redditmedia.com/o47j6d3ubas21_t5_2qio8/horde'}, {'a': ':alliance:', 'e': 'emoji', 'u': 'https://emoji.redditmedia.com/goroi8cl9as21_t5_2qio8/alliance'}]",1,"because those are the unique ones that people actually want. not ""horse, color #40""",wow,0.3122527487622945,angry
[],1,"that's peculiar and needs more upvotes.

that said, keys can be cracked. eventually someone randomly hacking in numbers is gonna get your key by accident...",wow,0.5482155572017887,angry
"[{'a': ':alliance:', 'e': 'emoji', 'u': 'https://emoji.redditmedia.com/goroi8cl9as21_t5_2qio8/alliance'}, {'a': ':warlock:', 'e': 'emoji', 'u': 'https://emoji.redditmedia.com/9t4aj3ytbas21_t5_2qio8/warlock'}]",1,i thought the staff he’s holding was an arrow pointing at something. it took me longer than i’d care to admit that it wasn’t.,wow,0.6258617405650861,angry
"[{'a': ':horde:', 'e': 'emoji', 'u': 'https://emoji.redditmedia.com/o47j6d3ubas21_t5_2qio8/horde'}, {'a': ':warlock:', 'e': 'emoji', 'u': 'https://emoji.redditmedia.com/9t4aj3ytbas21_t5_2qio8/warlock'}]",1,""" yeah no i disagree with you on warlock and dks. they aren’t sociopaths  who just happen to be on your side, they are depicted as die hard heroes  with morals identical to the demon hunters. all 3 of the classes are  ends justifies the means. ""

&amp;#x200b;

btw warlocks still reside solely in murder row, shady bars, and the cleft, like always. like i said, adventurer locks are the only ones really treated well.",wow,0.5044432563512478,angry
"[{'a': ':paladin:', 'e': 'emoji', 'u': 'https://emoji.redditmedia.com/uvkv4eutbas21_t5_2qio8/paladin'}]",1,"i love how you disregarded and ignored all of the other points in order to address a wise-ass comment which i ended with ""for the sake of argument, i'll pretend it's true.""

in reality you don't have a leg to stand on, because you ask for citations and sources in the lore to disprove your head canon.  however, once i did, you then try and discredit that exact same lore because of previous retcons.  also, i'm not sure why you think that i'm angry when i'm simply doing as you asked by providing sources to support my own stance.",wow,0.32491528304853523,angry
[],1,"and giving them to a class that, historically, are night elf outcasts. 

the weapons were used by sentinels, so the in-game analogue would be nelf warriors, hunters, and maybe rogues (or dks as a ""former sentinel"").

annoying.",wow,0.3801763660886194,angry
[],1,"you're correct, except there is a choice for existing players to choose either the new 1-10 island expedition for shadowlands or the classic (or cata) starting zone. i believe they said they would do the same level squish for non-allied death knights and demon hunters. and, if a new player does the island expedition, their second character also has the above choice of starting location.

to further expand, from 10-50 they can choose which expansion to play through. but, you are not locked to this choice. and apparently if this is your first character (aka a new player), then bfa will be your default choice. at least, this was said at blizzcon. i suppose you could change mid-course though.",wow,0.6008685260645921,angry
[],1,"dude, saving one person doesn't erase murdering thousands in cold blood. you don't suddenly nullify psychopathically murdering thousands of people looking into their eyes just because you save one person.",wow,0.3505373536346603,angry
[],1,thx man,wow,0.7675451857167859,happy
[],1,thanks!!!,wow,0.8534682682767623,happy
[],1,one you pay the time ticks down. they dont have a way to stop it so if you already payed for the time no it will be gone by the time shadow lands hits,wow,0.4959103997868351,angry
