author_flair_richtext,score,body,subreddit,log_proba,log_adjust
[],1,"&gt; did you seriously just say demon hunters don’t do what they say they do? they literally destroyed the nathrezim homeworld.

...?

i said they're not antiheroes. where does that translate into them not destroying the nathrezim homeworld? the nathrezim totally had it coming. 

&gt;they enslaved sapient creatures on draenor.

illidan did that. i already named illidan as the exception.

&gt;they murdered for azeroth. they will literally kill themselves for azeroth.

uhhh, this description applies to just about every wow champion.

&gt;also no. self preservation would be never setting foot in the chapel.

clearly not, because they stepped in the chapel and got out just fine? there's short term preservation, and there's long term preservation. stepping in the chapel knowing the paladins won't attack them doesn't conflict with preservation at all. pissing off the paladins with no intention of calming them down does conflict with self-preservation.

&gt;also i love how you completely ignored all the parts about dks expressing they dont want to fight the paladins.

...no i don't? i literally spent the comment explaining why they don't want to fight the paladins.

the strongest paladin on azeroth was able to kill the strongest death knight on azeroth with one sword strike. 

that's why death knights don't want to fight the paladins.

&gt;even kelthuzad freaks out about his cat. dude absolutely loved that thing.

taking a small in-game meme moment as a cornerstone of your lore argument means your argument doesn't have merit.",wow,0.19394974797115255,angry
[],1,"ive made it my mission to fly under the invisible wall at every given oppertunity. im making it to the inmost questgivers almost every time now.  


i will have my fun blizzard, regardless of how hard you try to take it away for no reason.",wow,0.439617656304191,angry
"[{'a': ':alliance:', 'e': 'emoji', 'u': 'https://emoji.redditmedia.com/goroi8cl9as21_t5_2qio8/alliance'}, {'a': ':druid:', 'e': 'emoji', 'u': 'https://emoji.redditmedia.com/zx1xwa2ubas21_t5_2qio8/druid'}]",1,"i racked up about 32 110-120s for the final two world boss mounts, i might try to use them for the love rocket since last two years the family holiday was scheduled for the same two weeks. is it only 120s that get the appropriate mount-possible loot box? i'm conflicted because longboi being removed is getting me desperately trying to rack up the required gold. damned if i'm missing another mount that's going to be unattainable soon!",wow,0.5098068781691898,angry
[],1,i'm having a harder time imagining someone caring about getting this mount.,wow,0.64036063384226,angry
[],1,"to be honest i got it from my first run, i thought it had a 100% drop chance until i got whispered by one guy crying about how lucky i am",wow,0.5926455863268676,angry
[],1,凯尔萨斯 you mean?,wow,0.717664105153952,happy
"[{'a': ':alliance:', 'e': 'emoji', 'u': 'https://emoji.redditmedia.com/goroi8cl9as21_t5_2qio8/alliance'}, {'a': ':shaman:', 'e': 'emoji', 'u': 'https://emoji.redditmedia.com/du6y2ixtbas21_t5_2qio8/shaman'}]",1,yeah but they're a new race for _alliance_. if horde got dark irona then that'd be a new race instead of customization options,wow,0.7040583376816029,happy
[],1,just a scratch,wow,0.1855096228642727,angry
"[{'a': ':horde:', 'e': 'emoji', 'u': 'https://emoji.redditmedia.com/o47j6d3ubas21_t5_2qio8/horde'}, {'a': ':priest:', 'e': 'emoji', 'u': 'https://emoji.redditmedia.com/v7o30swtbas21_t5_2qio8/priest'}]",1,"i don't participate in pvp so i can't possibly answer that, sorry.",wow,0.6162166582142344,angry
[],1,pre-ordering bfa: when you were wrong to trust a fart.,wow,0.6687935123637576,angry
[],1,unpopular opinion: i like the few extra seconds before being able to pull aleria.  allows for a better timed prepot/sanity reset.  like a built in countdown before a raid boss pull.,wow,0.5214356637282256,angry
"[{'a': ':horde:', 'e': 'emoji', 'u': 'https://emoji.redditmedia.com/o47j6d3ubas21_t5_2qio8/horde'}, {'a': ':monk:', 'e': 'emoji', 'u': 'https://emoji.redditmedia.com/1xf0739ubas21_t5_2qio8/monk'}]",1,"i can confirm these are not bannable offenses. about 11 years ago when i was a wee lad, i put in a ticket because people had been corpse camping me for 3 hours, and the gm response was legit ""get off the pvp server or git gud"", except in more professional terms.",wow,0.529942952475304,angry
"[{'a': ':alliance:', 'e': 'emoji', 'u': 'https://emoji.redditmedia.com/goroi8cl9as21_t5_2qio8/alliance'}, {'a': ':warrior:', 'e': 'emoji', 'u': 'https://emoji.redditmedia.com/fhl5b6ztbas21_t5_2qio8/warrior'}]",1,"lore should factor into gameplay.   
for elune's sake there's bunch of rp servers. go make a character named nubpwner or sylvanasnelfpwner (nelf of course) on a rp server and enjoy blizzard forcing you to rename your character.   


if we abandon lore, the next thing that will happen with wow will be endless retcon. at that point, why even restrict classes to races? just enable a tauren rogue and undead paladin already!

&amp;#x200b;

and to be honest if you could allow undead be priests; add dh with 2specs and let druids have 4, you could also restrict a spec to the race.  


or even better, make race exclusive hero classes. lf draenei hero class and void elf  hero. they have done it with demon hunters and didn't break the lore.   


if they have followed your line of logic we would be full of vulpera demon hunters right now.",wow,0.41452870593034696,angry
[],1,"thanks for the link, and good points. what about pvp viability? in my previous playing days, there were “meta” classes that dominated for entire xpacs such as rogues, warriors, paladins, etc.

while shamans, druids, etc were usually not in meta.",wow,0.7327025958035946,happy
[],1,i agree.  i'm tired of 'pathfinder' questlines.  geezus!  just let us fly already!,wow,0.5129418507173702,angry
"[{'a': ':horde:', 'e': 'emoji', 'u': 'https://emoji.redditmedia.com/o47j6d3ubas21_t5_2qio8/horde'}, {'a': ':monk:', 'e': 'emoji', 'u': 'https://emoji.redditmedia.com/1xf0739ubas21_t5_2qio8/monk'}]",1,"i also had a ton of fun, i played from launch until 8.3 release and was meme'ing out on my boomkin with the guild i was in. hope you enjoy your return!",wow,0.7960143770761045,happy
[],1,"i still like briny barnacle for ret paladin

my favortie trinket was the darkmoon fathoms deck, how i wish you could get a higher ilvl one. nothing beat dropping fat anchors on some fools",wow,0.5727103701272683,angry
[],1,reminds me of majoras mask,wow,0.7439326991914629,happy
[],1,i feel you. a mix of high ping and all my friends no longer playing makes me not want to do arena. i would feel bad burdening anyone i don't know simultaneously with my poor internet and poor gameplay.,wow,0.32697472992586174,angry
[],1,timeskips are gay.,wow,0.7439326991914629,happy
[],1,"if all u know is mediocrity then u can’t be blamed for a terrible take like this. not your fault really. in classic most items only give you 2-3% dps increase. these are like 50%+, it’s quite different. sucks that you don’t know better but all i can say is try playing other games or using your imagination to think outside of blizzards lil box",wow,0.21838377622651664,angry
"[{'a': ':alliance:', 'e': 'emoji', 'u': 'https://emoji.redditmedia.com/goroi8cl9as21_t5_2qio8/alliance'}, {'a': ':horde:', 'e': 'emoji', 'u': 'https://emoji.redditmedia.com/o47j6d3ubas21_t5_2qio8/horde'}]",1,"the chains shouldnt make you silenced, the pull/stun if pulled is more than enough punish. at least for alleria.",wow,0.6576787455275775,angry
"[{'a': ':alliance:', 'e': 'emoji', 'u': 'https://emoji.redditmedia.com/goroi8cl9as21_t5_2qio8/alliance'}, {'a': ':paladin:', 'e': 'emoji', 'u': 'https://emoji.redditmedia.com/uvkv4eutbas21_t5_2qio8/paladin'}]",1,"as others have said the wod drought was over a year and it won't be that long. either way they can take all the time in the world as far as i'm concerned. hell, take 2 years. as long as the time is used to ensure shadowlands is a great expansion i'm all for it because i can't take another bfa.",wow,0.5780828305357947,angry
"[{'a': ':paladin:', 'e': 'emoji', 'u': 'https://emoji.redditmedia.com/uvkv4eutbas21_t5_2qio8/paladin'}]",1,"&gt;are you able to cite where it's stated that did paladins use light?

literally in the class description of paladin.  all paladins are holy warriors that gain powers and blessings from the light, and i'm talking lore-wise and not just ingame mechanics.

* draenei paladins gained their power and connection to the light by naaru.
* human paladins started out as clerics of the holy order of northshire clerics, aka priests who trained in martial combat to better protect themselves.
* dwarves were trained as paladins by humans.
* high elves also believed in the holy light, and paladins likely existed before exposure to the human and dwarven order of the silver hand (high elf paladins still exist, serving the silver covenant)
* blood elf paladins received their power by siphoning the light energy of mu'ru, an imprisoned naaru (again, a being of light).  later, they draw their energy from the restored sunwell, which is now infused with the light.
* tauren paladins, aka sunwalkers, receive their powers by drawing the light energy from an'she, the sun.
* zandalari paladins, aka prelates, draw their power from worship and belief in rezan, the holy loa of kings.  it is unknown what connection rezan has with the light, but it does exist.
* the few night elf paladins receive their light connection through elune, who velen believes may be a naaru.

trying to suggest that dark iron paladins are not actual paladins, but receive ""light-like abilities"" from fire elementals is absurd.

&amp;#x200b;

&gt;also, shaman are different. shaman get their powers by cooperating and bargaining with elementals. paladins get their power through pure belief. the former is a relationship of peers. the latter is a relationship of subservience.

dark shaman gain their powers by binding and enslaving elements, using the powers of decay, and not cooperating or bargaining.  this is how the kor'kron shaman retained their powers, and why thrall was unable to commune with the elements when he confronted garrosh (they had been forced from the area).

furthermore, belief is not a ""relationship of subservience.""  subservience is the ""willingness to obey others unquestionably.""  tirion fordring broke his vows and was exiled from the order of the silver hand for saving eitrigg's life.  he even retained his light-given abilities even after uther performed a ceremony to strip him of them, further proving that it is not a ""relationship of subservience.""

&amp;#x200b;

&gt;if a dark iron dwarf were to fervently worship a powerful fire elemental, who rewards the did with searing powers thanks to his belief, that has far more similarities to a paladin than a shaman.

dark iron dwarves never *worshipped* fire elementals. the entire clan was enslaved by ragnaros and his minions when sorceror-thane thaurissan accidentally summoned ragnaros during the war of the three hammers.

&amp;#x200b;

&gt;i think you're interpreting game mechanics into lore too rigidly.

and i think you're lacking a basic grasp of lore altogether, if you believe that out of every paladin race in the game, dark irons are the only ones who do not use light or holy magic (which is literally the only thing that makes a paladin a paladin), and instead uses some sort of facsimile based on the incorrect belief that they worship fire elementals.",wow,0.5637623401219379,angry
"[{'a': ':alliance:', 'e': 'emoji', 'u': 'https://emoji.redditmedia.com/goroi8cl9as21_t5_2qio8/alliance'}, {'a': ':rogue:', 'e': 'emoji', 'u': 'https://emoji.redditmedia.com/dprfoxvtbas21_t5_2qio8/rogue'}]",1,"i have like 5 headless horseman mounts in my bank, but have never seen this drop for anyone",wow,0.6200288918503488,angry
[],1,"vulpera are not in any way 'more of an entirely new race'. their rig is similar to goblins, their models are furry goblins, their backstory is honourable goblins. mechagnomes have unique limbs.

look, i don't think mechagnomes are an amazing race. but all this ""vulpera are literally a new race while mechagnomes are just recoloured gnomes"" bullshit needs to die. mechagnomes aren't unique, but neither are fucking vulpera. hell, isn't the entire point of allied races that it lets blizzard introduce races that aren't that unique? of course they broke that mould with zandalari and kul tirans, and they're reaping the rewards now.

and don't fucking complain about horde being able to grind out mechagnomes. the problem is having to grind at all. or, at the very least, having to grind both factions at all. have vulpera unlock mechagnomes, and the other way around. have kul tirans unlock zandalari, and so on. i don't fucking give a shit about alliance having easier access to horde races, or the other way around. nobody complained about being able to make worgen or goblins without a grind.",wow,0.21359002929846999,angry
"[{'a': ':horde:', 'e': 'emoji', 'u': 'https://emoji.redditmedia.com/o47j6d3ubas21_t5_2qio8/horde'}, {'a': ':monk:', 'e': 'emoji', 'u': 'https://emoji.redditmedia.com/1xf0739ubas21_t5_2qio8/monk'}]",1,"the thing is that blizzard's tos has a provision that specifically says they reserve the right to ban you for any reason, or even no reason at all. you're just renting the account from them and have no actual ownership over it yourself, so property rights do not apply in this situation and you're entirely up to blizzard's mercy.

to op, blizzard will never give you the information you're looking for, quite possibly because even the gms may not have access to it. even if they did have access to it, they generally just don't put that information out because in their view, that just gives information to bot/hack developers on what specifically to avoid. i won't lie, i strongly disagree with their policies on ban appeals and reasoning, and think there are many ways they could really improve it, but it's not like we can do anything about it.",wow,0.3377286765771288,angry
[],1,no need to insert a title.  this patch is indeed a dumpster fire.,wow,0.6824528993691216,angry
"[{'a': ':alliance:', 'e': 'emoji', 'u': 'https://emoji.redditmedia.com/goroi8cl9as21_t5_2qio8/alliance'}, {'a': ':paladin:', 'e': 'emoji', 'u': 'https://emoji.redditmedia.com/uvkv4eutbas21_t5_2qio8/paladin'}]",1,"i would love worgen monks, but i want a worgen paladin moreso.",wow,0.5814243492652348,angry
"[{'a': ':alliance:', 'e': 'emoji', 'u': 'https://emoji.redditmedia.com/goroi8cl9as21_t5_2qio8/alliance'}, {'a': ':paladin:', 'e': 'emoji', 'u': 'https://emoji.redditmedia.com/uvkv4eutbas21_t5_2qio8/paladin'}]",1,two weeks is actually a good bit of time when you are talking about an mmo with time gated content.,wow,0.6353744742040336,angry
[],1,my blood dk seems invincible compared to my brewmaster monk.  i feel your pain.  i hate the demon hunter class.   everyone is a dh and also the fact that you can only be a blood elf or a night elf.,wow,0.46372769111645396,angry
[],1,there's no way that detour would save you any time.,wow,0.6372786879292099,angry
"[{'a': ':alliance:', 'e': 'emoji', 'u': 'https://emoji.redditmedia.com/goroi8cl9as21_t5_2qio8/alliance'}, {'a': ':deathknight:', 'e': 'emoji', 'u': 'https://emoji.redditmedia.com/kbwt6n89aas21_t5_2qio8/deathknight'}]",1,"i used a macbook then a macbook pro for ~7-8 years for gaming, including wow. if there was something i desperately wanted to play that was only on windows i’d use boot camp.

worked really well, and never had any issues with either of them.

i did eventually get a gaming pc because i no longer lived at home, and couldn’t justify another mac, but i’d absolutely buy one again.",wow,0.5642573503392561,angry
[],1,ms surface works great.,wow,0.8861838398950458,happy
[],1,i don't want to play a class that is dependent on azerite traits to work. will boost a paladin come next expansion,wow,0.40111849878226835,angry
"[{'a': ':alliance:', 'e': 'emoji', 'u': 'https://emoji.redditmedia.com/goroi8cl9as21_t5_2qio8/alliance'}, {'a': ':paladin:', 'e': 'emoji', 'u': 'https://emoji.redditmedia.com/uvkv4eutbas21_t5_2qio8/paladin'}]",1,"you probably just got reported by a bunch of people for being a dick or griefing people, that's exactly what it sounds like. either that or people just reported you because they were being dicks. it happens all the time, it's fine, move on.",wow,0.2410844007676431,angry
[],1,it still feels bad. and that means it's bad design,wow,0.7222146635402497,happy
"[{'a': ':horde:', 'e': 'emoji', 'u': 'https://emoji.redditmedia.com/o47j6d3ubas21_t5_2qio8/horde'}, {'a': ':shaman:', 'e': 'emoji', 'u': 'https://emoji.redditmedia.com/du6y2ixtbas21_t5_2qio8/shaman'}]",1,the weirdest thing is how people ignore every expansion requiring players to go back to the capitols to use the auction house. how is there supposed to be a time skip in azeroth when we're constantly going back there?,wow,0.3509625182677579,angry
[],1,this makes me want to wubba lubba dubb resubb,wow,0.34960831136133913,angry
[],1,i meant the gym leader one when they get to their last mon,wow,0.7532635693130765,happy
,1,[removed],wow,0.7439326991914629,happy
"[{'a': ':demonhunter:', 'e': 'emoji', 'u': 'https://emoji.redditmedia.com/rgmxx30ubas21_t5_2qio8/demonhunter'}]",1,"in case you didnt notice, the mantid are swarming, those invisible walls are the best defence against them flying in",wow,0.6977539855512795,angry
"[{'a': ':alliance:', 'e': 'emoji', 'u': 'https://emoji.redditmedia.com/goroi8cl9as21_t5_2qio8/alliance'}, {'a': ':paladin:', 'e': 'emoji', 'u': 'https://emoji.redditmedia.com/uvkv4eutbas21_t5_2qio8/paladin'}]",1,"you know what he means, no need to go all internet specific.",wow,0.6692801296620794,angry
[],1,"fully disagree, it's kind of fun and hectic. standing in her face and just stomping her would be objectively more boring.",wow,0.5895845596651372,angry
"[{'a': ':horde:', 'e': 'emoji', 'u': 'https://emoji.redditmedia.com/o47j6d3ubas21_t5_2qio8/horde'}, {'a': ':warlock:', 'e': 'emoji', 'u': 'https://emoji.redditmedia.com/9t4aj3ytbas21_t5_2qio8/warlock'}]",1,"did you seriously just say demon hunters don’t do what they say they do? they literally destroyed the nathrezim homeworld.

they enslaved sapient creatures on draenor.

they murdered for azeroth. they will literally kill themselves for azeroth. 

also no. self preservation would be never setting foot in the chapel.

also i love how you completely ignored all the parts about dks expressing they dont want to fight the paladins. like blatantly showing empathy for the paladins.

also btw canonically undead still show emotions it’s just nowhere near as strong as when they were alive, and they still have empathy. several undead in wow have shown empathy. the only one who have never really shown empathy is anubarak and characters we get little to no screen time with.

even kelthuzad freaks out about his cat. dude absolutely loved that thing.",wow,0.2556291798490754,angry
"[{'a': ':alliance:', 'e': 'emoji', 'u': 'https://emoji.redditmedia.com/goroi8cl9as21_t5_2qio8/alliance'}, {'a': ':paladin:', 'e': 'emoji', 'u': 'https://emoji.redditmedia.com/uvkv4eutbas21_t5_2qio8/paladin'}]",1,do you mean having one price for each region? it's a bad idea because different currencies and exchange rates exist.,wow,0.5930029423760206,angry
[],1,"i jumped in diablo 3 last night with some buddies, we created seasonal hardcore characters, there was tension and it was fun.

risk creates fun.",wow,0.7840491196127798,happy
[],1,hp pavillion should be fine,wow,0.7120465578683816,happy
"[{'a': ':horde:', 'e': 'emoji', 'u': 'https://emoji.redditmedia.com/o47j6d3ubas21_t5_2qio8/horde'}, {'a': ':alliance:', 'e': 'emoji', 'u': 'https://emoji.redditmedia.com/goroi8cl9as21_t5_2qio8/alliance'}]",1,over 8000 attempts from the previous 10 years and no mount. this year i only have 104 characters at max level. guessing i won't get it this year either but i will try.,wow,0.6585447761011701,angry
[],1,"if you have damaged hardware, that's the hardware's fault either through failure or bad design. hardware is supposed to be able to handle whatever software does, even if it ""handles it"" by suddenly freezing or powering off.",wow,0.4778251133756173,angry
"[{'a': ':mage:', 'e': 'emoji', 'u': 'https://emoji.redditmedia.com/6u3tc9stbas21_t5_2qio8/mage'}]",1,"good thing i'm a mage without heals, wasting time with conjured food during visions. it was kinda scary going into horrific visions solo at first",wow,0.6672795081623728,angry
[],1,"the horde one is pretty annoying too. my annoyance is not with the hyjal portal but rather the one from deepholm. i can craft deepholm potions and have them on all my alts. but, the deepholm portal also goes to the portal room instead of the cata ones. thankfully, tol barad still goes to the right place though only my main has the tabard.",wow,0.47515341707383235,angry
[],1,"i think they already do that, just check your minimap.",wow,0.4637890845947246,angry
[],1,yes,wow,0.8095423296981789,happy
[],1,"it matters in a raiding guild. if 1 boomkin has t3 stars/ev etc this coming week and 1 doesn't, it's not a mystery which one will ride the bench.",wow,0.5280156611770248,angry
[],1,"eh i came back after a long break and decided to finally try out my druid again (was my main in legion). im having a lot of fun with it, the gear and ap catch up system is nice for returning players or making a new alt. the only annoying part to me is grinding rep to unlock flying but you can obviously get by without flying if you don't feel like dealing with extra dailies.",wow,0.4586043301056806,angry
"[{'a': ':alliance:', 'e': 'emoji', 'u': 'https://emoji.redditmedia.com/goroi8cl9as21_t5_2qio8/alliance'}, {'a': ':warlock:', 'e': 'emoji', 'u': 'https://emoji.redditmedia.com/9t4aj3ytbas21_t5_2qio8/warlock'}]",1,thanks!,wow,0.8534682682767623,happy
[],1,"oh boo hoo, its not running for 2 weeks after a big patch. ofc theyre gonna take care of windows users bugs/fixes first, because thats where majority of the playerbase is. you can literally ask them to refund your time and they will",wow,0.5020245581498493,angry
[],1,"pugs on n'zoth: bad.  
as healer, i've endured 30+ wipes in two days, knowing all tacs, being the last few standing the whole time. so. damn. frustrating.",wow,0.48611418299232523,angry
"[{'a': ':warrior:', 'e': 'emoji', 'u': 'https://emoji.redditmedia.com/fhl5b6ztbas21_t5_2qio8/warrior'}]",1,"5 weeks is more than a month, thats not a short time.",wow,0.6616436098056935,angry
[],1,echoing will still be good for you. you don't need to only use corruption that gives you healing just because you're a healer. really strong damage corruptions like echoing will still be good because of the dps they will provide for your group. you can apply this same mindset to trinkets and essences aswell.,wow,0.6351583049895421,angry
[],1,i left got into a new guild,wow,0.5356880578006388,angry
"[{'a': ':horde:', 'e': 'emoji', 'u': 'https://emoji.redditmedia.com/o47j6d3ubas21_t5_2qio8/horde'}, {'a': ':priest:', 'e': 'emoji', 'u': 'https://emoji.redditmedia.com/v7o30swtbas21_t5_2qio8/priest'}]",1,"that looks like they're all pretty even to me. within more or less 5k of each other, at absolute perfect simulated gameplay on a patchwerk boss (which is not at all realistic play). when you look at [actual dps on actual bosses by actual average players](https://www.warcraftlogs.com/zone/statistics/24#dataset=50) the numbers are way different and much more even.

also, never use noxxic. noxxic is so well known for being awful, [even wow developers have openly shamed it](https://youtu.be/doj_4tn1yba?t=2294) in interviews for ""misinformation"" back in wod.

unless you are a hardcore bleeding edge mythic raider, these tiny differences do not make a difference in average gameplay. besides, anything that is top right now might not be top next week when a balance patch comes out, so choosing what is best *now* is silly. someone who plays a middle of the road spec *very* well will beat someone who plays the ""best"" spec only *decently* because they just rerolled to it.",wow,0.5633783000490649,angry
[],1,that show has a really crazy following. they went ape shit for some damn mcdonald’s mulan sauce just because of that show. don’t try to reason with them just walk away.,wow,0.1438698903309051,angry
[],1,"yeah actually, spot on",wow,0.7509670111678718,happy
[],1,because it’s the “proper” way i guess,wow,0.6430060029085843,angry
"[{'a': ':horde:', 'e': 'emoji', 'u': 'https://emoji.redditmedia.com/o47j6d3ubas21_t5_2qio8/horde'}, {'a': ':demonhunter:', 'e': 'emoji', 'u': 'https://emoji.redditmedia.com/rgmxx30ubas21_t5_2qio8/demonhunter'}]",1,"hey, when it isnt though, it pumps

doesnt work on good players sadly",wow,0.8192543635007615,happy
[],1,oh thanks for the tip!,wow,0.8350565276272122,happy
[],1,"i gotta be honest, i love the corruption mechanic as it currently sits.  i only have the quest piece you get, but i'm loving the absolute chaos rng op pieces are causing.  sometimes i just want to watch the world burn.",wow,0.49199398520625276,angry
"[{'a': ':horde:', 'e': 'emoji', 'u': 'https://emoji.redditmedia.com/o47j6d3ubas21_t5_2qio8/horde'}, {'a': ':shaman:', 'e': 'emoji', 'u': 'https://emoji.redditmedia.com/du6y2ixtbas21_t5_2qio8/shaman'}]",1,if given the choice you would go back to the old ah? i find that hard to believe.,wow,0.6702163435268927,angry
"[{'a': ':horde:', 'e': 'emoji', 'u': 'https://emoji.redditmedia.com/o47j6d3ubas21_t5_2qio8/horde'}, {'a': ':alliance:', 'e': 'emoji', 'u': 'https://emoji.redditmedia.com/goroi8cl9as21_t5_2qio8/alliance'}]",1,"token price is region based, not server based.

everything about your comment is incorrect.",wow,0.7275910173990233,happy
