author_flair_richtext,score,body,subreddit,log_proba,log_adjust
"[{'a': ':horde:', 'e': 'emoji', 'u': 'https://emoji.redditmedia.com/o47j6d3ubas21_t5_2qio8/horde'}, {'a': ':warlock:', 'e': 'emoji', 'u': 'https://emoji.redditmedia.com/9t4aj3ytbas21_t5_2qio8/warlock'}]",1,"there are some good ideas here, though i think you'd get a lot of people angry that their class didn't get as much stuff as the others.

that said, please give affliction and demonology some benefit from green fire again.

also give affliction any spell effects that feel satisfying at all but that's a different rant.",wow,0.21527344593917716,angry
[],1,"me reading the first time:

crawling in my skin

these woons they will not heal




me reading the second time:

craaaaawwwling innn my skinnnn

these wooons they willll not heeyulll",wow,0.6578575941114011,angry
[],1,i was wondering this myself. i think i'll pay attention to the responses.,wow,0.6264913264266858,angry
[],1,"sure, a bullet.

the sword of sargeras is not a bullet relative to azeroth.",wow,0.8291059109793462,happy
"[{'a': ':alliance:', 'e': 'emoji', 'u': 'https://emoji.redditmedia.com/goroi8cl9as21_t5_2qio8/alliance'}, {'a': ':druid:', 'e': 'emoji', 'u': 'https://emoji.redditmedia.com/zx1xwa2ubas21_t5_2qio8/druid'}]",1,it's worth checking out all of nhym and summergale's old machinima. they made some great ones.,wow,0.7751522534893389,happy
[],1,still more effort than what blizzard did since 7.0,wow,0.6928556040213726,angry
"[{'a': ':horde:', 'e': 'emoji', 'u': 'https://emoji.redditmedia.com/o47j6d3ubas21_t5_2qio8/horde'}, {'a': ':warlock:', 'e': 'emoji', 'u': 'https://emoji.redditmedia.com/9t4aj3ytbas21_t5_2qio8/warlock'}]",1,"no my formatting is because i'm on mobile. i'm not enraged, stop trying to discredit me because you got called out for knowing jack.

&amp;#x200b;

"" lol bro, you said ""kill for azeroth"". killing for azeroth isn't the same  thing as ""ritualistically sacrificing for azeroth"". surely you can calm  down enough to see that what you said, and what you meant, are very  different? ""

&amp;#x200b;

if you actually played the scenarios it wouldn't mater. you would know exactly what i'm referring to

&amp;#x200b;

"" so do lots of other people on azeroth. plenty of quests involve the pc  or npc allies torturing. there's so much torture in quests it's  ridiculous. ""

&amp;#x200b;

link it. show me evidence that the mage order hall, the paladin, the priest, the hunter .etc all comited torture, ritualistic murder and suicide .etc.

&amp;#x200b;

"" also i don't see how committing suicide makes them anti-heroes. they  don't hurt anyone but themselves when they commit suicide. that's pretty  heroic. ""

&amp;#x200b;

heroes don't perform black magic that requires them to literally stab themselves or murder others. thats anti-hero and villain territory. if you don't see superman or spider-man doing it, then its probably anti-hero or villain territory. 

&amp;#x200b;

"" bro, i mained a dk through all of legion. i did play the order hall  campaign. like i said, going to the chapel is long-term  self-preservation. lose a battle, win the war. ""

doubt, the way you react and your knowledge makes me think your lieing or remember jack and just want to stick your head in the ground.

&amp;#x200b;

"" nah, not really, because all of the star wars heroes have clear moral  lines they won't cross. death knights don't. the only lines they don't  cross are the ones that put them in existential danger. like warring  with paladins. ""

there's literally an entire subreddit dedicated to the heroes being villains. it would be fucking easy with your logic.

&amp;#x200b;

"" actions aren't what define a sociopath. their mindset is. sociopaths can  do good things and be good people. i don't think you know what  sociopathy is. ""

no i don't think you do.

 ""a person with a personality disorder manifesting itself in extreme antisocial attitudes and behavior and a lack of conscience. ""

see that lack of conscience thing? 

"" an inner feeling or voice viewed as acting as a guide to the rightness or wrongness of one's behavior ""

oh look, what was that thing i said? they felt bad about going to fight paladins, and regretted it, and darian tried to somewhat fix their mistake by helping the paladins, oh yeah that falls under conscience.",wow,0.19351459120831319,angry
"[{'a': ':alliance:', 'e': 'emoji', 'u': 'https://emoji.redditmedia.com/goroi8cl9as21_t5_2qio8/alliance'}, {'a': ':druid:', 'e': 'emoji', 'u': 'https://emoji.redditmedia.com/zx1xwa2ubas21_t5_2qio8/druid'}]",1,can you show us a copy of the e-mail?,wow,0.7439326991914629,happy
[],1,the first pic of all of the giant squire boys standing ominously in boralus is going to haunt my dreams.,wow,0.679012357166276,angry
[],1,"wow dude, you have very bad reading comprehension.

1. i said they're sociopathic, not psychopathic. those are different.
2. i said dk are anti-heroes. i said dh are the ones that aren't.
3. punisher is actually textbook psychopathic.
4. you're the one trying to argue that dk are straight up heroes.",wow,0.4897538314741123,angry
"[{'a': ':horde:', 'e': 'emoji', 'u': 'https://emoji.redditmedia.com/o47j6d3ubas21_t5_2qio8/horde'}, {'a': ':paladin:', 'e': 'emoji', 'u': 'https://emoji.redditmedia.com/uvkv4eutbas21_t5_2qio8/paladin'}]",1,i went over to the market west of ramkahen.  plenty of the squid faced mobs there to kill to get it quick.,wow,0.4577490677673427,angry
[],1,that's a good point!,wow,0.8256356013344014,happy
[],1,oh man that takes me back...and not in a good way lol. anyone remember grande cock the devirginator?,wow,0.8465856299858987,happy
[],1,i'm imagining a variation on an ancient greek theatre... such a playful idea!,wow,0.6978812675399896,angry
[],1,some times they leave bullets in if they are to close to the spine,wow,0.6633992953262308,angry
"[{'a': ':alliance:', 'e': 'emoji', 'u': 'https://emoji.redditmedia.com/goroi8cl9as21_t5_2qio8/alliance'}, {'a': ':mage:', 'e': 'emoji', 'u': 'https://emoji.redditmedia.com/6u3tc9stbas21_t5_2qio8/mage'}]",1,god forbid we fly into a giant ass chamber.,wow,0.5283823602155252,angry
"[{'a': ':horde:', 'e': 'emoji', 'u': 'https://emoji.redditmedia.com/o47j6d3ubas21_t5_2qio8/horde'}, {'a': ':paladin:', 'e': 'emoji', 'u': 'https://emoji.redditmedia.com/uvkv4eutbas21_t5_2qio8/paladin'}]",1,doesn't mind flay automatically make you face your target?,wow,0.49602058512104336,angry
[],1,what the fuck ive failed trying to do two side areas three times now with my fury warrior. guess its time to quit wow,wow,0.555018822362387,angry
[],1,"&gt;i know that's what i'm saying. to complete that quest, you literally dont have to kill the dragons. that was an achievement that was later removed. there is no reason to kill them.

it doesn't matter if you have to or don't have to. the point is the quest was designed with the intent of making it completely within rational behavior of the pc to kill them, for ""no reason"" as you agree.

therefore, it is canon that the dk champion is perfectly capable of killing red dragons for no reason, other than to kill them. whether he does or doesn't isn't the point - the point is that it's perfectly within his moral compass to do so.

&gt;and you're right, being a powerful paladin isnt necessary to be a powerful death knight. but a lot of the greatest death knights have been paladins.

only because the initial dks were paladins. if the initial dks had all been normal warriors, then a lot of the greatest dks would've been warriors. the fact that there were a lot of paladins was just the way things played out, and had nothing to do with them being paladins.

&gt;the whole ebon blade schtick is basically ""fuck honor we'll do what's best to save the planet."" that's what ""we do what the living cannot,"" means.

once again, raising a red dragon and trying to raise tirion are neither the objectively best ways to save the planet.

they are the best ways to get whatever the ebon blade wants without concern for anyone else.

sociopathy doesn't mean evil or that they can't be trying to save the planet. this is how sociopathy is described:

&gt;antisocial personality disorder is defined by a pervasive and persistent disregard for morals, social norms, and the rights and feelings of others. individuals with this personality disorder will typically have no compunction in exploiting others in harmful ways for their own gain or pleasure and frequently manipulate and deceive other people, achieving this through wit and a façade of superficial charm or through intimidation and violence. they may display arrogance, think lowly and negatively of others, and lack remorse for their harmful actions and have a callous attitude to those they have harmed.

this doesn't mean this is the *only* way they're capable of thinking. this doesn't mean they can only be harmful people. but this absolutely describes the instinct of how death knights think and act.",wow,0.20405669146093847,angry
[],1,"many of us lost trust in blizzard to write deep stories after the bfa prelaunch event.  


*morally grey*  btw.  


that's pretty much why many of us dont trust them. (and the fact that i didnt really like legion's story that much with how they gave the legion flying spaceships and magical floating doom machines). but hey, to each their own.",wow,0.5316982403921805,angry
"[{'a': ':horde:', 'e': 'emoji', 'u': 'https://emoji.redditmedia.com/o47j6d3ubas21_t5_2qio8/horde'}, {'a': ':warlock:', 'e': 'emoji', 'u': 'https://emoji.redditmedia.com/9t4aj3ytbas21_t5_2qio8/warlock'}]",1,keep in mind the dps gain/ corruption isn't as high as it looks. getting rank 3 infinite stars is more like getting all your corrupted pieces all at once.,wow,0.5598895765154529,angry
"[{'a': ':druid:', 'e': 'emoji', 'u': 'https://emoji.redditmedia.com/zx1xwa2ubas21_t5_2qio8/druid'}]",1,"if only there were systems that could allow for players to improve their characters without leveling up and renting power through a brand new gimmick each expansion.
&amp;nbsp;

there are in plenty of other games, but blizzard has shown no indication of interest in them.",wow,0.6761371111709448,angry
"[{'a': ':horde:', 'e': 'emoji', 'u': 'https://emoji.redditmedia.com/o47j6d3ubas21_t5_2qio8/horde'}, {'a': ':warlock:', 'e': 'emoji', 'u': 'https://emoji.redditmedia.com/9t4aj3ytbas21_t5_2qio8/warlock'}]",1,fuck off,wow,0.09585998932299088,angry
"[{'a': ':horde:', 'e': 'emoji', 'u': 'https://emoji.redditmedia.com/o47j6d3ubas21_t5_2qio8/horde'}, {'a': ':warlock:', 'e': 'emoji', 'u': 'https://emoji.redditmedia.com/9t4aj3ytbas21_t5_2qio8/warlock'}]",1,heh. burning.,wow,0.7439326991914629,happy
"[{'a': ':alliance:', 'e': 'emoji', 'u': 'https://emoji.redditmedia.com/goroi8cl9as21_t5_2qio8/alliance'}, {'a': ':mage:', 'e': 'emoji', 'u': 'https://emoji.redditmedia.com/6u3tc9stbas21_t5_2qio8/mage'}]",1,i have too much to do with visions and shit to do events like that.,wow,0.22797421109726862,angry
[],1,"dog shit show, dog shit meme",wow,0.5900470083752833,angry
[],1,bro wtf is this. you know what they meant.,wow,0.5392279835035418,angry
[],1,"i was late to this xpack and got a huge shock at how the professions had been stripped down! 
also, not a flaw but i was surprised how spread out the recipes are. as in, i get four recipes at once then nothing for 10-15 levels of the skill. so it's spam one recipe ten to twenty times, then move to next.",wow,0.6986848017012863,angry
[],1,"this one here?:

https://appleinsider.com/articles/18/10/24/ibm-seeing-great-returns-on-over-277000-macs-and-ios-devices-issued-to-employees

the one that allows people to choose macs (company-wide), meaning that marketing and sales are going to make up a hefty share. these people generally understand mac better either because they had one in college or the luxury effect makes learning to use it more interesting. these people are also likely to travel the most, meaning that they were likely treating the old computer poorly while traveling. they also had the option to significantly reduce the cost to the company by buying it from the company at the end of life cycle because macbook have historically held value better. this all makes sense and isn't shocking, but the lead is somewhat buried. 

they developed a custom deployment to make it viable. this could be a very effective new lead-in to the enterprise market if apple worked with ibm to push it. the issue is that macs are generally bothersome to incorporate into an enterprise environment because they're harder to centrally control. if it has them, whatever because they're supposed to be safe. if an end user has them, i better make sure to have an apple server running and someone to configure that, and a new set of higher paid service desk that can troubleshoot macs. it becomes cost inefficient in almost all deployments outside of smaller shops. i would not want to try and work with legal or soxs requests in most situations.",wow,0.37229823569237264,angry
[],1,"i'm a mage, i have to kite. i know you can aim in a direction, but that doesn't null the fact that it's just not an enjoyable mechanic. it actually ruins the vision imo. last week was great, this week was unbearable due to this mechanic.",wow,0.40694520199796363,angry
[],1,"it is the guarenteed corruption on the 2h axe from maut which i dont believe is implemented in sims correctly, and if it is was more designed for blood dk in mind anyway since it is an armour based corruption.",wow,0.6139215833676931,angry
[],1,i miss corpse explosion i used to use it way to much. the glyph sucks ass and depresses me,wow,0.44583706249194627,angry
"[{'a': ':horde:', 'e': 'emoji', 'u': 'https://emoji.redditmedia.com/o47j6d3ubas21_t5_2qio8/horde'}, {'a': ':shaman:', 'e': 'emoji', 'u': 'https://emoji.redditmedia.com/du6y2ixtbas21_t5_2qio8/shaman'}]",1,it's probably because i had about 100+ sets saved to mogit.,wow,0.6730057858511574,angry
[],1,"simple fix would be to let you run the dungeons more often and tone back the rewards a bit.

instead of 3-4 runs / week, make it 15 / week, giving the first 5 succesful tries 60% of the current rewards or something like that.

it would at least lessen this crushing feeling when you fuck a run up.



looking back at me and my brothers 0.2% wipe last time, he had the cursed item from nazjatar in his bag.. killing him just fast enough to miss our upgrade, damn still mad about that one haha.",wow,0.4018148459317489,angry
[],1,the dk ability they let you be your zombie when you died though i would add giving the zombie a combat rez but not have it work on the death knight.,wow,0.6470591614471115,angry
[],1,they wanted it to match this patches qa success rate.,wow,0.7565437306716332,happy
[],1,jesus. thanks for the reminder that i’m old as fuck.,wow,0.39181281273689306,angry
[],1,"dude, your formatting and coherency is breaking down in your rage. take a deep breath, calm down a bit, and do better than let a lore discussion about wow control your emotional state. that's not a way to live life bro.

&gt;no it doesn't. the other champions will not murder dragons or paladins to save the world. they wont ritualistically sacrifice unwilling people for their cause. nor will they do it with willing people.

lol bro, you said ""kill for azeroth"". killing for azeroth isn't the same thing as ""ritualistically sacrificing for azeroth"". surely you can calm down enough to see that what you said, and what you meant, are very different?

when we're killing boars to level up to defeat threats to azeroth, that's ""killing for azeroth"".

&gt;dhs will torture, ritualistically sac, and commit suicide for their cause.

so do lots of other people on azeroth. plenty of quests involve the pc or npc allies torturing. there's so much torture in quests it's ridiculous.

not sure what you mean by ""ritualistically sac"". like i said, chill out and calmly and concisely state your point dude.

also i don't see how committing suicide makes them anti-heroes. they don't hurt anyone but themselves when they commit suicide. that's pretty heroic.

&gt;play the damn order hall campaign.

bro, i mained a dk through all of legion. i did play the order hall campaign. like i said, going to the chapel is long-term self-preservation. lose a battle, win the war.

&gt;saying self preservation non stop means nothing. as i said, by your logic, star wars has no heroes, everyone is a sociopath.

nah, not really, because all of the star wars heroes have clear moral lines they won't cross. death knights don't. the only lines they don't cross are the ones that put them in existential danger. like warring with paladins.

&gt;you have yet to show sociopathic tendencies from the dk orderhall, while i keep pointing out how they have done non sociopathic things, and you try to hand wave or just keep repeating yourself. 

actions aren't what define a sociopath. their mindset is. sociopaths can do good things and be good people. i don't think you know what sociopathy is.

&gt;also hilarious that you think that when wow constantly has memes become lore and bring full storys and expansions about it.

lol, if your argument here is that wow has entire expansions based on memes, is it really worth getting as worked up as you are over a game that bases entire chunks of its core stories around memes?",wow,0.17791070441074763,angry
"[{'a': ':alliance:', 'e': 'emoji', 'u': 'https://emoji.redditmedia.com/goroi8cl9as21_t5_2qio8/alliance'}, {'a': ':mage:', 'e': 'emoji', 'u': 'https://emoji.redditmedia.com/6u3tc9stbas21_t5_2qio8/mage'}]",1,"arthas is cool but a fallen hero story is one of the most cookie cutter things they can produce. they are simply not good at writing stories, they are good at showing cool things and having us do cool things and they need to go back to just trying to do that",wow,0.7677364943077112,happy
"[{'a': ':alliance:', 'e': 'emoji', 'u': 'https://emoji.redditmedia.com/goroi8cl9as21_t5_2qio8/alliance'}, {'a': ':druid:', 'e': 'emoji', 'u': 'https://emoji.redditmedia.com/zx1xwa2ubas21_t5_2qio8/druid'}]",1,"your right, i forgot about that entirely.",wow,0.6267153174009926,angry
[],1,"i fucking hate trying to pvp when everyone is divebombing you at lightspeed from the sky. war mode was so much better with feet on the ground, not these aliens zipping around for quick tags.",wow,0.32126257015009063,angry
[],1,"yeah, but i'm a mage. so kiting is something i have to do. it's just a bad mechanic.",wow,0.6264897527019643,angry
"[{'a': ':monk:', 'e': 'emoji', 'u': 'https://emoji.redditmedia.com/1xf0739ubas21_t5_2qio8/monk'}]",1,"&gt;you didn’t read my comment, or even grasp the point i’m trying to make. i’m saying lore shouldn’t always factor into gameplay.

an awfully bold statement when it's abundantly clear you didn't ""read or even grasp"" the original comment you were replying to.

 had you, you would note he asks about specifically about the lore. 

gameplay is a question you decided to answer that was never asked, which is one of the reasons i even wrote ""to be fair to op"" - because you never even *answered* his question, you responded with a tangent on gameplay and, in a spectacular demonstration of how warriors make no use of the intellect stat but apparently irony, patronized him with a ""don't over think it"". 

/u/avgvstvs wrote: 

&gt;lore wise, how come all light casters/users are able to still wield light when they are affected by the corruption of the void?

&gt;also why aren't shadow casters such as shadow priest and warlock more influenced by the corruption and buffed, considering it's their domain? 


there is no **lore wise** reason. blizzard has been categorically inconsistent with the lore surrounding light and void intermingling. alleria and turalyon not being able to touch was a cool throw-away plot thread that retconned the twilights, disc priest lore, the crucible, and a host of other things and will continue to confuse everyone as they soldier onward. for the second bit, shadow priests and warlocks likely do interact differently with the corruption permeating everything, but there aren't any central warlock or shadow priest characters at the moment. anduin seems to be affected by it but as far as we can tell that might just be everybody and not specifically related to him being a priest. 

of *course* from a gameplay perspective it would be a matter of developing peculiar interactions based on spec of class, but it's pretty clear for anyone who *reads his comment or grasps it at all* that when avgvstvs starts off his comment with, ""how come all light casters/users are able to still wield light when they are affected by the corruption of the void"" it's pretty obvious he isn't asking, ""how come blizz didn't disable the paladin class, one and a half specs of the priest, and the entire lightforged race while adding bonuses to shadow priests and warlocks?""  

tip: if what you're about to argue against sounds absurd, maybe ask them to clarify. turns out, not skipping over the first two words of his post would probably assist in making a response. 

on account of some trouble with reading comprehension, i'll break down how my original comment response to your post for you:

you wrote:

&gt;some things simply get handwaved because they don’t fit in the lore

i wrote:

&gt;blizzard usually does the exact opposite

by which i mean, instead of introducing gameplay which contradicts lore and dismissing it (which is fine), they introduce lore that contradicts already existing lore and gameplay, for seemingly no reason. and then just kind of go with it.

for example, *again*, alleria and turalyon not being able to touch. in an expansion that *just* introduced a host of disc priests with stories about intermingling light and shadow and light's wrath as their artifact. in a class hall where light and shadow ""twist about one another."" several expansions after we did the whole ""light + shadow = twilight?!"" thing. 

you wrote: 

&gt;blizzard can absolutely say “turalyon and alleria are a married couple who can’t even touch each other because they’re light and shadow, respectively” while also introducing a playable void elf class that can also be a holy priest and wear void corrupted gear,

yes that's fine, until-

&gt;..and still be consistent. 

they have not. it isn't consistent. at all. light's wrath is inconsistent. canon disc priest figures are inconsistent. the twilights and archbishop benedictus are inconsistent. they could have avoided every inconsistency (*including* the gameplay ones, if you insist on bringing up gameplay at all) by leaving out that turalyon and alleria can't touch. 

which is why i wrote,

&gt;why not just leave the whole void and light thing interacting off the table? leave it opened ended, make it a mystery, or simply say ""sure they work, it's called twilight stuff and we have an entire flight of dragons and cult about it! remember that archbishop benedictus and his whole light-and-shadow thing?""

is this at all making more sense to you? the rest of your post with regards to blizzard and the suspension of lore in lieu of gameplay i have no issue with - although you were arguing a point that didn't need to be argued. 

&gt;what would you have them do -

not create new lore (which currently serves no purpose until probably a void expansion, who knows how far into the future) that contradicts old lore *and* more new lore that just occurred. 

&gt;allow void elves to be priests, but only shadow spec? let lf draenei be priests, but only holy?

i wasn't implying that. /u/avgvstvs wasn't implying that. nobody was implying that. nobody brought up gameplay until *you* did, and then proceeded to complain your tangent on gameplay wasn't being grasped while never understanding the post you were replying to in the first place. magnificent. truly. 

avgvstvs wrote:

&gt;edit: what the hell? downvotes? **for asking a question about lore?** smh

gunna go out on a limb and assume that was your doing. ;)
he's in the positives now anyway, it would appear other people were able to *read and grasp* that ""lore wise"" meant ""lore wise"" and not ""gameplay."" imagine that!",wow,0.280888433997248,angry
[],1,this in fucking spades.,wow,0.07869201094657145,angry
"[{'a': ':horde:', 'e': 'emoji', 'u': 'https://emoji.redditmedia.com/o47j6d3ubas21_t5_2qio8/horde'}, {'a': ':deathknight:', 'e': 'emoji', 'u': 'https://emoji.redditmedia.com/kbwt6n89aas21_t5_2qio8/deathknight'}]",1,"i know that's what i'm saying. to complete that quest, you literally dont have to kill the dragons. that was an achievement that was later removed. there is no reason to kill them.

we wanted to raise this specific red dragon because this specific one had unusually powerful life magic that would be powerful necromantic magic in undeath . the red dragons didnt want us to do it. that's why we were in conflict with the red dragonflight, but like i said, you dont actually have to kill them to complete the quest.

and you're right, being a powerful paladin isnt necessary to be a powerful death knight. but a lot of the greatest death knights have been paladins.

if the legion is here and the greatest living paladin just died, it makes sense to bring him back to help fight the legion. youre right, it isn't respectful, but that doesnt make it sociopathic. 

the whole ebon blade schtick is basically ""fuck honor we'll do what's best to save the planet."" that's what ""we do what the living cannot,"" means.",wow,0.16475441053827192,angry
"[{'a': ':druid:', 'e': 'emoji', 'u': 'https://emoji.redditmedia.com/zx1xwa2ubas21_t5_2qio8/druid'}]",1,"it's pretty close to ""why even give them money?"" for me.",wow,0.5362941151789706,angry
[],1,"cascade, chakras 😔",wow,0.7439326991914629,happy
[],1,commemorate?,wow,0.7439326991914629,happy
