author_flair_richtext,score,body,subreddit,log_proba,log_adjust
[],1,ive heard great things about legion - i'm really hoping thats the next expansion im lined up to tackle xd im super excited to check out the artifacts and collect them for transmogs!,wow,0.5707086509528352,angry
[],1,"sorry for my ignorism, i've played only one rpgmmo in my life. i thought you can do something cool like stealing things like in witcher or collecting something... idk man, i like gameplay with many options of playstyles.",wow,0.6306457516353025,angry
[],1,no worries man! you can do it!,wow,0.7675451857167859,happy
[],1,"same here! only the last time i played pre bfa was classic xd so it was a lot of fun to enjyo the previous zones hassle-free! me and my partner are both constantly saying "" i really like this place"" while we quest and do legion - something we didnt really find as much with pandaria honestly - definately my favourite zones to date xd",wow,0.5281781175842446,angry
[],1,"it's a parody of ""so let's do it like they do it on the discovery channel"" from the song bad touch, bloodhound gang",wow,0.5042331919022802,angry
[],1,awesome ill take a look this evening. appreciate it,wow,0.8956693243630237,happy
"[{'a': ':alliance:', 'e': 'emoji', 'u': 'https://emoji.redditmedia.com/goroi8cl9as21_t5_2qio8/alliance'}, {'a': ':warrior:', 'e': 'emoji', 'u': 'https://emoji.redditmedia.com/fhl5b6ztbas21_t5_2qio8/warrior'}]",1,you're a scary psycho,wow,0.7439326991914629,happy
"[{'a': ':horde:', 'e': 'emoji', 'u': 'https://emoji.redditmedia.com/o47j6d3ubas21_t5_2qio8/horde'}, {'a': ':warrior:', 'e': 'emoji', 'u': 'https://emoji.redditmedia.com/fhl5b6ztbas21_t5_2qio8/warrior'}]",1,"you didn’t read my comment, or even grasp the point i’m trying to make. i’m saying lore shouldn’t always factor into gameplay. 

blizzard can absolutely say “turalyon and alleria are a married couple who can’t even touch each other because they’re light and shadow, respectively” while also introducing a playable void elf class that can *also* be a holy priest and wear void corrupted gear, and still be consistent. 

[gameplay and story segregation](https://tvtropes.org/pmwiki/pmwiki.php/main/slidingscaleofgameplayandstoryintegration?from=main.gameplayandstoryintegration) is a common trope in many other games, and wow makes extensive use of it, in *many* other ways. certainly there’s a right way and a wrong way to go about it, but i think generally blizzard’s got a good track record about this sort of thing, with regards to race/class combos. 

what would you have them do - allow void elves to be priests, but only shadow spec? let lf draenei be priests, but only holy?",wow,0.4182326851918096,angry
"[{'a': ':horde:', 'e': 'emoji', 'u': 'https://emoji.redditmedia.com/o47j6d3ubas21_t5_2qio8/horde'}, {'a': ':druid:', 'e': 'emoji', 'u': 'https://emoji.redditmedia.com/zx1xwa2ubas21_t5_2qio8/druid'}]",1,it's like titanforging with 200 ilvls and some negative effects.,wow,0.6501394241754052,angry
[],1,incredible,wow,0.8161256408430319,happy
[],1,(be sure to get a contract. at least it helps.),wow,0.8291059109793462,happy
"[{'a': ':alliance:', 'e': 'emoji', 'u': 'https://emoji.redditmedia.com/goroi8cl9as21_t5_2qio8/alliance'}, {'a': ':deathknight:', 'e': 'emoji', 'u': 'https://emoji.redditmedia.com/kbwt6n89aas21_t5_2qio8/deathknight'}]",1,"eh some of us aren't interested in classic at all. despite retail being in the horrible state it is right now.

i'm 30 bro. i don't have the time to invest in classic. 

the fact of the matter is that wod had way more content for it's last patch. almost every expansion has. 

this patch will last minimum 10 months. we know for a fact they're behind schedule on shadowlands and if they rush another expansion out the door it will be disastrous.",wow,0.5128891182402643,angry
[],1,well you can't beat your azerite without a proper tool.,wow,0.6978661988286693,angry
"[{'a': ':hunter:', 'e': 'emoji', 'u': 'https://emoji.redditmedia.com/5e23dd8ubas21_t5_2qio8/hunter'}]",1,"i do.

it's just lame.",wow,0.1855096228642727,angry
"[{'a': ':rogue:', 'e': 'emoji', 'u': 'https://emoji.redditmedia.com/dprfoxvtbas21_t5_2qio8/rogue'}]",1,i dunno. the satisfaction of nailing it seems worth it.,wow,0.7730377200929541,happy
"[{'a': ':demonhunter:', 'e': 'emoji', 'u': 'https://emoji.redditmedia.com/rgmxx30ubas21_t5_2qio8/demonhunter'}]",1,no its an item you buy that gives an item a socket,wow,0.7059749497815186,happy
[],1,"&gt;""you're definitely guilty but we can't reveal the evidence, have a prison sentence"". it doesn't actually work like that, you do in fact reveal to a thief how they got caught. that stops you from putting people in prison on completely unsubstantiated claims with zero evidence.

not to the extent that you reveal your methods though. there's a difference between ""we have you on video"" and ""we have you on video that we shot using the hidden security camera facing the door from the right side corner of the hallway""...",wow,0.43456797322842927,angry
"[{'a': ':rogue:', 'e': 'emoji', 'u': 'https://emoji.redditmedia.com/dprfoxvtbas21_t5_2qio8/rogue'}]",1,i never got 'do it like a druid in the general channel'',wow,0.6895833000765649,angry
[],1,"metrics and fear of missing out are community derived social constructs.  if you're prioritizing your individual parses versus team performance, you're part of the problem.

don't blame blizz for your compensation of your impotence.",wow,0.6165224970714951,angry
[],1,"org and stormwind have the same ""timer"" but org lacks rp, court of stars and other dungeons did not have the same timer at all so this doesn't compare imo, unless i missed something",wow,0.4858668820448563,angry
"[{'a': ':horde:', 'e': 'emoji', 'u': 'https://emoji.redditmedia.com/o47j6d3ubas21_t5_2qio8/horde'}, {'a': ':monk:', 'e': 'emoji', 'u': 'https://emoji.redditmedia.com/1xf0739ubas21_t5_2qio8/monk'}]",1,"you’re not special, blizzard hates us all.",wow,0.7305426143796442,happy
[],1,yeah for sure. i just wasn't able to put the time into classic like i used to. not downing it at all.,wow,0.5494452867890792,angry
[],1,"well, at high level, most raid druids are boomkin, and in m+  - resto. generally speaking feral and guardians are not popular. but i have seen bears and kitties do well in heroic raids and m 10+ and higher, so they are viable if people know what they are doing.

i have low geared feral and they are fun. i think they added some sounds and visuals to spice up the kitty combat, so at least they look and sound fun :-)",wow,0.6733174775003921,angry
[],1,na hordie,wow,0.7439326991914629,happy
"[{'a': ':horde:', 'e': 'emoji', 'u': 'https://emoji.redditmedia.com/o47j6d3ubas21_t5_2qio8/horde'}, {'a': ':mage:', 'e': 'emoji', 'u': 'https://emoji.redditmedia.com/6u3tc9stbas21_t5_2qio8/mage'}]",1,"i haven't been playing for a while, but i try and keep up with the lore.

last i saw was the raid ending cinematic, is the before or after that?",wow,0.5900990065057854,angry
[],1,"it's their insistence on having like 4 difficulty levels per raid. you gotta have 60 ilvls worth of spread (15 separating each tier). when you got 3-4 major raids an expac, you're looking at a 180-240 ilvl jump every time. this is why we were at like 1000ilvl last expac. we're just going to be there again next expac too. there is no reason for it to be this drastic of a jump per tier. two difficulties split by 5-10 ilvl would be more than enough.",wow,0.4553712709513448,angry
"[{'a': ':horde:', 'e': 'emoji', 'u': 'https://emoji.redditmedia.com/o47j6d3ubas21_t5_2qio8/horde'}, {'a': ':druid:', 'e': 'emoji', 'u': 'https://emoji.redditmedia.com/zx1xwa2ubas21_t5_2qio8/druid'}]",1,i hate it.,wow,0.1985134832780674,angry
"[{'a': ':horde:', 'e': 'emoji', 'u': 'https://emoji.redditmedia.com/o47j6d3ubas21_t5_2qio8/horde'}, {'a': ':hunter:', 'e': 'emoji', 'u': 'https://emoji.redditmedia.com/5e23dd8ubas21_t5_2qio8/hunter'}]",1,"you can shard as long as you stay in the same zone. i jumped from nazjatar to nazjatar cta groups with the n'zoth buff on, sniped my low health party members while they fought the other faction, then left so they couldn't retaliate. if you have a few friends you can even make a fake cta group, gank the unlucky soul who joins your group and then kick them out before they can fight back.",wow,0.5501945643886399,angry
"[{'a': ':paladin:', 'e': 'emoji', 'u': 'https://emoji.redditmedia.com/uvkv4eutbas21_t5_2qio8/paladin'}]",1,it's popular because it's strong.,wow,0.7656902093410479,happy
"[{'a': ':horde:', 'e': 'emoji', 'u': 'https://emoji.redditmedia.com/o47j6d3ubas21_t5_2qio8/horde'}, {'a': ':hunter:', 'e': 'emoji', 'u': 'https://emoji.redditmedia.com/5e23dd8ubas21_t5_2qio8/hunter'}]",1,so even though they nerfed it a few days ago it’s still that powerful?,wow,0.6682636327231272,angry
"[{'a': ':horde:', 'e': 'emoji', 'u': 'https://emoji.redditmedia.com/o47j6d3ubas21_t5_2qio8/horde'}, {'a': ':hunter:', 'e': 'emoji', 'u': 'https://emoji.redditmedia.com/5e23dd8ubas21_t5_2qio8/hunter'}]",1,"am i the only one that doesn't hate the long draught of content between expansions? gives you time to go enjoy other games / life lol, then when expansion is out it's even more hype.",wow,0.4972547740612773,angry
[],1,"i don't do this cause i haven't cut it as close doing a +2, but have you tried killed the 2 guards out front first thing and walking in the cathedral to start the rp, then leaving to do your 2 zones and coming back to finish her at the end?

she should just be waiting there for you ready to attack.",wow,0.37541084880694664,angry
"[{'a': ':alliance:', 'e': 'emoji', 'u': 'https://emoji.redditmedia.com/goroi8cl9as21_t5_2qio8/alliance'}, {'a': ':paladin:', 'e': 'emoji', 'u': 'https://emoji.redditmedia.com/uvkv4eutbas21_t5_2qio8/paladin'}]",1,"lorewalker cho could be in charge, maybe? given all the lore presentations he did back in mop",wow,0.6262106668477879,angry
[],1,a perfect redraw of my spirit meme. i love it.,wow,0.7880179530333808,happy
[],1,rip us i guess,wow,0.6597541519724077,angry
[],1,"we're not talking about scaling to player level. this was worse. many games scale content to the player and do it just fine. this was a distinct power cliff though. we got *weaker* every level, i've never played a game like that, and i've played both those games. the cliff from 115 to 116, when you lost your legendaries, was the most demoralizing moment of the entire leveling process. i may as well have turned into a wet sponge.",wow,0.4284070863639829,angry
"[{'a': ':monk:', 'e': 'emoji', 'u': 'https://emoji.redditmedia.com/1xf0739ubas21_t5_2qio8/monk'}]",1,"that aren't viable? certain specs are perceived as unviable e.g. arcane mage in raid or ret paly and windwalker monk. also ranges are not so popular in m+.

i personally play dh since the start of the expansion and it's always been one of the top tier choices for m+ and one of the better melees for the raid (currently maybe even the best). i believe it's also strong in pvp but pvp of really scuffed right now due to corruption.",wow,0.5760789417427252,angry
"[{'a': ':horde:', 'e': 'emoji', 'u': 'https://emoji.redditmedia.com/o47j6d3ubas21_t5_2qio8/horde'}, {'a': ':monk:', 'e': 'emoji', 'u': 'https://emoji.redditmedia.com/1xf0739ubas21_t5_2qio8/monk'}]",1,"it could be fake but they do do that. i once made fun of j. allen brack and the reason listed was “illegal”. i asked them repeatedly what that meant and they literally told me if i asked again it was considered harassment. 

blizzard moderation is a joke.",wow,0.5221782805195764,angry
"[{'a': ':horde:', 'e': 'emoji', 'u': 'https://emoji.redditmedia.com/o47j6d3ubas21_t5_2qio8/horde'}, {'a': ':mage:', 'e': 'emoji', 'u': 'https://emoji.redditmedia.com/6u3tc9stbas21_t5_2qio8/mage'}]",1,but it makes you wonder how it released this way to begin with. did no one take a step back and look at what they were developing at any time and try and figure out of it was going in the direction that they stated they wanted to go in? wasnt this on the ptr for a generous amount of time? how the fuck did it release as a literal opposite of what they said they wanted.,wow,0.33241221771010787,angry
[],1,"honestly i agree, as long as they better indicate if an objective is above/below you cuz that was annoying in wrath",wow,0.6630324765254035,angry
[],1,"&gt; city raids and taking over opposing towns almost never happened for fear of dhks

maybe now, but in p1 there was plenty of this.  

the first 3-4 weeks of classic was honestly the best gaming experience i've had in a very long time. the sense of community was there, the magic was there, genuine open world engagement was happening, and stuff like city raids and takeovers were extremely common at least on my server.

while the players have changed in general, i don't think it's entirely our fault. clearly the want is still there for that classic styled mmo community, but devs just keep messing it up with nonsensical things.",wow,0.45003179589672526,angry
[],1,how do you know what the requirements are for the cloak upgrades but dont know that its time gated? lol,wow,0.4750089338900922,angry
"[{'a': ':horde:', 'e': 'emoji', 'u': 'https://emoji.redditmedia.com/o47j6d3ubas21_t5_2qio8/horde'}, {'a': ':paladin:', 'e': 'emoji', 'u': 'https://emoji.redditmedia.com/uvkv4eutbas21_t5_2qio8/paladin'}]",1,"sadly other than raids, dungeons, and mage tower, all content is made with the presumption that you're playing dps. and it wouldn't even be that hard to design things for everyone.

wqs: in those fill the bar type quests, add some healable npcs
visions: add some npcs that can be dispelled to restore sanity
island expeditions: again, healable/dispellable npcs that add to the progress",wow,0.6708507640107891,angry
"[{'a': ':warrior:', 'e': 'emoji', 'u': 'https://emoji.redditmedia.com/fhl5b6ztbas21_t5_2qio8/warrior'}]",1,"and on that day, boralus received a grim reminder.",wow,0.6333925767033799,angry
[],1,"this. i'm an officer in mine and we do make doubly certain that our raiders get a key done for the 465 or highest reward, but when it gets towards the end of monday, we all get together for mythics to push with as many people as possible. one or two raiders per group to help the guild overall.",wow,0.5238569104297267,angry
[],1,i guess it would only work if the classes in your group will benefit from it. but one of the issues would be is that you are constantly on the move in m+. might be fun to experiment though,wow,0.671294939936538,angry
"[{'a': ':alliance:', 'e': 'emoji', 'u': 'https://emoji.redditmedia.com/goroi8cl9as21_t5_2qio8/alliance'}, {'a': ':demonhunter:', 'e': 'emoji', 'u': 'https://emoji.redditmedia.com/rgmxx30ubas21_t5_2qio8/demonhunter'}]",1,"all they need to do is keep titanforging and put in a currency system so that you can grind out +5 ilvl bonuses, sockets, and tertiary stats on items.

sometimes you'll get lucky and get a +20 ilvl titanforge. bam. easy. other times you won't and you'll have to do a bunch of content to get the currency.

here's an idea: make it cost some amount of residuum. award a small amount of residuum for each successfully timed mythic keystone over a certain level. maybe make it drop from raid bosses (guaranteed) or pvp as well.

the idea is that you will always have a path to progress. you might get lucky, but you will never get completely blocked by bad luck and hard work will always let you reach max gear.

heck, they could even do it with the corruption effects. i like having gear that makes me feel overpowered. the problem is when i get 2-3 pieces of top corruption and my buddy gets void ritual and that haste proc, so even though we are playing at an equal skill level i dumpster him on the meters.",wow,0.49032918117706814,angry
"[{'a': ':alliance:', 'e': 'emoji', 'u': 'https://emoji.redditmedia.com/goroi8cl9as21_t5_2qio8/alliance'}, {'a': ':warrior:', 'e': 'emoji', 'u': 'https://emoji.redditmedia.com/fhl5b6ztbas21_t5_2qio8/warrior'}]",1,your friends will betray you.,wow,0.48835793374909264,angry
"[{'a': ':horde:', 'e': 'emoji', 'u': 'https://emoji.redditmedia.com/o47j6d3ubas21_t5_2qio8/horde'}, {'a': ':warrior:', 'e': 'emoji', 'u': 'https://emoji.redditmedia.com/fhl5b6ztbas21_t5_2qio8/warrior'}]",1,... they've been working on shadowlands since bfa launch...,wow,0.5153045717137177,angry
"[{'a': ':alliance:', 'e': 'emoji', 'u': 'https://emoji.redditmedia.com/goroi8cl9as21_t5_2qio8/alliance'}, {'a': ':shaman:', 'e': 'emoji', 'u': 'https://emoji.redditmedia.com/du6y2ixtbas21_t5_2qio8/shaman'}]",1,"&gt; i am just choosing to memorise the encounter over letting an addon do it for me.  
&gt;  
&gt;for rl and tanks its mandatory for healer and dps unless your doing mythic you can still do the fight well without it. 

since you're not using boss mods, and you acknowledge that you would need it to do mythic, then i'm going to assume you aren't doing mythic raids. so then, what is even your point? you don't need addons to do easy content? nobody cares how people do easy content.",wow,0.3566970581186581,angry
[],1,"it's got a weekly max. the first week was 6, second (this week) is 7, next week is 8, etc.",wow,0.5893138040023211,angry
"[{'a': ':alliance:', 'e': 'emoji', 'u': 'https://emoji.redditmedia.com/goroi8cl9as21_t5_2qio8/alliance'}, {'a': ':priest:', 'e': 'emoji', 'u': 'https://emoji.redditmedia.com/v7o30swtbas21_t5_2qio8/priest'}]",1,yes it [is](https://ptr.wowhead.com/news=306277/legendary-cloak-upgrades-will-be-weekly-capped-with-a-catch-up-mechanism).,wow,0.774572374897886,happy
[],1,it looks cool in 5 second gif. doing this 40 times to get it right can’t be fun,wow,0.766921192257433,happy
[],1,you flat out can't use the best corruption traits if your cape isn't high enough,wow,0.7056131458756335,happy
[],1,macbook lul? sinds wanneer hebben macbooks een lul?,wow,0.7439326991914629,happy
[],1,this is correct.,wow,0.7439326991914629,happy
[],1,"area 52 player here, i've never had a wait time in the past 4 years since i transferred here",wow,0.5917463365881603,angry
[],1,kite/los her around pillars so she will leave any puddles she is in.,wow,0.6537481405491968,angry
"[{'a': ':horde:', 'e': 'emoji', 'u': 'https://emoji.redditmedia.com/o47j6d3ubas21_t5_2qio8/horde'}, {'a': ':rogue:', 'e': 'emoji', 'u': 'https://emoji.redditmedia.com/dprfoxvtbas21_t5_2qio8/rogue'}]",1,"when i load into a zone from a teleport or logging it it takes forever, then the world loads in and i can move my character (as shown on the mini ma by the map moving) but nothing else is loaded in.

my gaming laptop is 5 years old, but it should not be having issues like that on wow of all games, let alone when i set it to 5 out of 10 for graphics settings.",wow,0.6416670050733296,angry
[],1,"..or just take the money you would spend on a mac laptop, and but 2 gaming pcs.",wow,0.3837855862839395,angry
[],1,"it's a bit grindy at the moment. if you just want to check out a story, it'll be ok. if you want to get into raiding, or m+, or pvp - lots of grinding ahead.",wow,0.4179214420314024,angry
[],1,"&gt; if you tell a thief how they got caught they won't do whatever got them caught again

""you're definitely guilty but we can't reveal the evidence, have a prison sentence"". it doesn't actually work like that, you do in fact reveal to a thief how they got caught. that stops you from putting people in prison on completely unsubstantiated claims with zero evidence.",wow,0.42306132343556635,angry
"[{'a': ':alliance:', 'e': 'emoji', 'u': 'https://emoji.redditmedia.com/goroi8cl9as21_t5_2qio8/alliance'}, {'a': ':deathknight:', 'e': 'emoji', 'u': 'https://emoji.redditmedia.com/kbwt6n89aas21_t5_2qio8/deathknight'}]",1,and then addons would counter them and make them a nonissue.,wow,0.5968657192190917,angry
[],1,"somewhat even servers are barely existent. 

i’ve been playing on some of the most populated servers for years and have never had to wait in a login queue outside of the first week of a new expansion. the only exception to this was illidan.

i don’t think you can go wrong with zul’jin, mal’ganis, area 52, thrall.",wow,0.39868620683820566,angry
"[{'a': ':priest:', 'e': 'emoji', 'u': 'https://emoji.redditmedia.com/v7o30swtbas21_t5_2qio8/priest'}]",1,it was just something for the first set of allied races. highmountain tauren and nightborne work but any allied races or heritage set doesn’t.,wow,0.6608926059582045,angry
[],1,thanks bro. any recommended dps classes that aren’t viable for pve and pvp,wow,0.7504020371635753,happy
"[{'a': ':paladin:', 'e': 'emoji', 'u': 'https://emoji.redditmedia.com/uvkv4eutbas21_t5_2qio8/paladin'}]",1,"am i understanding this video correctly? the comparisons are done on a single macbook, once on macos and then again in a bootcamped windows?

in which case, that video just proves the person you're responding to correct. just by bootcamping windows, they gained pretty much 5 fps instantly, not to mention that the graphics look obviously cleaner. now just imagine if you were playing it on a normal pc with hardware that wasn't designed specifically for macos.

not to mention that this guy's macbook pro likely cost him around $2500, with which you could [build this thing](https://pcpartpicker.com/user/bdrabenaldt/saved/#view=pgmzzl) and enjoy your 80+ fps at 1440p.

&gt; just upgraded to a pc recently to play more games and use more programs not available on mac and there is absolutely no difference between them

you're just outright lying here. are the games unplayable on a mac? no, but there is absolutely no question that getting the most out of your games is going to be on windows.",wow,0.27562681720352294,angry
"[{'a': ':monk:', 'e': 'emoji', 'u': 'https://emoji.redditmedia.com/1xf0739ubas21_t5_2qio8/monk'}]",1,you might have some luck here https://discord.gg/egppjqe there is a channel for 0-10 keys as well as a channel where some guys do events for new people to learn m+. though i'm not sure if the learning runs are still active.,wow,0.6709384192216445,angry
[],1,"keep in mind, wod also lasted 14 months while this likely lasts 8-10.

plus we have classic now which gets a new content patch next month to keep busy with.",wow,0.6060585015449187,angry
"[{'a': ':alliance:', 'e': 'emoji', 'u': 'https://emoji.redditmedia.com/goroi8cl9as21_t5_2qio8/alliance'}, {'a': ':warlock:', 'e': 'emoji', 'u': 'https://emoji.redditmedia.com/9t4aj3ytbas21_t5_2qio8/warlock'}]",1,yeah i play b oth and ffxiv does a good job of pruning useless abilities while adding in replacement ones that keep the class fantasy accurate.,wow,0.7589352395736051,happy
"[{'a': ':alliance:', 'e': 'emoji', 'u': 'https://emoji.redditmedia.com/goroi8cl9as21_t5_2qio8/alliance'}, {'a': ':horde:', 'e': 'emoji', 'u': 'https://emoji.redditmedia.com/o47j6d3ubas21_t5_2qio8/horde'}]",1,it’s not a solution. it’s a(n expensive) workaround that shouldn’t be needed. the game was working fine on the native os. blizzard pushed an update that broke it. it’s blizzard’s responsibility to fix their product. or provide refunds.,wow,0.554623089125041,angry
"[{'a': ':monk:', 'e': 'emoji', 'u': 'https://emoji.redditmedia.com/1xf0739ubas21_t5_2qio8/monk'}]",1,"to be fair to the op, blizzard usually does the exact opposite. 

for an example pertaining to this exact case, they went out of their way at the end of legion to explain that alleria as void and turalyon as light can't touch or even be too close to each other without hazardous consequences including but not limited to a violent explosion of some sort. 

not sure why they established this, because the patch after they introduced these characters and decided to add ""void"" to one and ""lightforged"" to the other, they added void elf holy priests and lightforged shadow priests. in an expansion that established disc priests as priests who combine shadow and light magic.  

and then now we  have the corruption effect. why not just leave the whole void and light thing interacting off the table? leave it opened ended, but blizzard *never* avoids painting themselves into a corner. 

they're like a mold that seems to thrive in damp corners.",wow,0.5436299800163767,angry
"[{'a': ':alliance:', 'e': 'emoji', 'u': 'https://emoji.redditmedia.com/goroi8cl9as21_t5_2qio8/alliance'}, {'a': ':warrior:', 'e': 'emoji', 'u': 'https://emoji.redditmedia.com/fhl5b6ztbas21_t5_2qio8/warrior'}]",1,but wait how does this work for kael'thas then? he became a fel riddled husk in the end..,wow,0.677114436093159,angry
[],1,"true, but if you’re just fishing for 445 you could still maximize titan residuum, even if only by a little.  or...maybe people are just following what someone else did and there’s no reason other than ignorance for doing a +6.  /shrug",wow,0.23966410094113924,angry
"[{'a': ':alliance:', 'e': 'emoji', 'u': 'https://emoji.redditmedia.com/goroi8cl9as21_t5_2qio8/alliance'}, {'a': ':paladin:', 'e': 'emoji', 'u': 'https://emoji.redditmedia.com/uvkv4eutbas21_t5_2qio8/paladin'}]",1,"the weekly chest drops a currency called titan residuum. 

it takes about 2-3 weeks of looting the chest to purchase a 475 piece depending on the level of keys you do.",wow,0.6365508798664211,angry
[],1,"maybe cause qa got fired, may be it's maybeline.  /shrug",wow,0.634112036208128,angry
[],1,what better tool for learning a fight is there than dbm? lmao.,wow,0.7041897633003628,happy
[],1,"the christmas event, idk if it drops anymore tho.",wow,0.6817674096748481,angry
[],1,"playing with people can be really fun, but for me personally i’m most immersed when i’m speed levelling or when i was grinding mage towers in legion. at work i’ll talk with people all day. wow for me is a way to just switch off that part of my brain and relax",wow,0.38647356327088794,angry
[],1,"see, my only other thought was maybe it has some kind of effect on corruption roll chance?  but i see no info anywhere that suggests either is true",wow,0.6988564646429725,angry
